,channel,title,view_count,like_count,upload_date,duration,was_live
5474,Windah Basudara,TAMAT? BAYANGAN JUGA MANUSIA! Shadow Fight 2 #9,543956,19032,2020-08-26T08:15:09Z,PT1H12M30S,1
5475,Windah Basudara,TAMAT! GLEDEK & SEMUA ADVANCEMENT YANG ADA DI LIST SELESAI - Minecraft,521170,14009,2020-08-24T23:09:53Z,PT2H51M43S,1
5476,Windah Basudara,BAYANGAN JUGA MANUSIA! NAMATIN Shadow Fight 2 #8,324932,9822,2020-08-24T18:48:12Z,PT1H17M8S,1
5477,Windah Basudara,TAMAT 100%! MAMA PASTI BANGGA! Beach Buggy Racing,683340,18978,2020-08-24T17:41:49Z,PT4H59M47S,1
5478,Windah Basudara,Minum Semua Potion & ... Gledek.... MINECRAFT,337304,13462,2020-08-23T23:41:26Z,PT7H32M54S,1
5479,Windah Basudara,EMASIN SEMUA MOBIL! MENUJU 100% BEACH BUGGY RACING #6,262339,8020,2020-08-23T15:13:10Z,PT1H17M12S,1
5480,Windah Basudara,MAMA AKU BALAPAN DI GUNUNG DULU YAH! NAMATIN Hill Climb Racing 2 #2,335813,10623,2020-08-23T10:33:42Z,PT2H18M10S,1
5481,Windah Basudara,BAYANGAN JUGA MANUSIA! NAMATIN Shadow Fight 2 #7,377213,12024,2020-08-23T07:39:48Z,PT1H23M10S,1
5482,Windah Basudara,SUDAH BUKAN BAYANGAN! NAMATIN Shadow Fight 3 #4,199782,6810,2020-08-23T06:12:10Z,PT1H3M49S,1
5483,Windah Basudara,TAMAT? The Henry Stickmin Collection PART 3,304306,10551,2020-08-22T16:49:03Z,PT45M7S,1
5484,Windah Basudara,BAYANGAN JUGA MANUSIA! NAMATIN Shadow Fight 2 #6,403406,12968,2020-08-22T15:46:28Z,PT1H49M36S,1
5485,Windah Basudara,MAMA AKU MAU MOBIL MEWAH! NAMATIN Asphalt 8 #4,160241,6259,2020-08-22T10:02:01Z,PT1H3M34S,1
5486,Windah Basudara,EMASIN SEMUA MOBIL! MENUJU 100% BEACH BUGGY RACING #5,209995,6711,2020-08-22T06:50:51Z,PT1H9M7S,1
5487,Windah Basudara,HARUS JALAN YANG MANA? NAMATIN The Henry Stickmin Collection PART 1,584233,18176,2020-08-21T15:28:34Z,PT33M18S,1
5488,Windah Basudara,MAMA AKU BALAPAN DI GUNUNG DULU YAH! NAMATIN Hill Climb Racing 2,1046730,31307,2020-08-21T14:51:48Z,PT1H15M13S,1
5489,Windah Basudara,SUDAH BUKAN BAYANGAN! NAMATIN Shadow Fight 3 #3,324258,9918,2020-08-21T12:20:12Z,PT2H3M41S,1
5490,Windah Basudara,BAYANGAN JUGA MANUSIA! NAMATIN Shadow Fight 2 #5,525194,16262,2020-08-21T10:02:29Z,PT1H55M47S,1
5491,Windah Basudara,Musim Salju Yang Indah dan Valentine - NAMATIN Harvest Moon Remake,62077,3015,2020-08-21T01:24:58Z,PT1H6M1S,1
5492,Windah Basudara,NAMATIN Resident Evil 2 Classic #2 (Part 1 Di Charity Covid Kemarin),54384,2458,2020-08-20T22:54:45Z,PT1H35M56S,1
5493,Windah Basudara,TANTANGAN 100% ADVANCEMENT MINECRAFT! Part 12,180090,6188,2020-08-20T20:28:44Z,PT2H49M38S,1
5494,Windah Basudara,BAYANGAN JUGA MANUSIA! NAMATIN Shadow Fight 2 #4,600593,19878,2020-08-20T15:42:31Z,PT1H51M3S,1
5495,Windah Basudara,EMASIN SEMUA MOBIL! MENUJU 100% BEACH BUGGY RACING #4,263145,7907,2020-08-20T14:01:10Z,PT1H8M52S,1
5496,Windah Basudara,NAMATIN Lego Batman Mode Penjahat PART 2 (PART 1 di charity kemarin),185939,7320,2020-08-20T10:36:37Z,PT53M24S,1
5497,Windah Basudara,"Armor Adamantite, Mimic Key, dan Boss The Destroyer! NAMATIN Terraria",131099,5180,2020-08-20T04:43:27Z,PT2H25M2S,1
5498,Windah Basudara,WITHER & BEACON TERKUAT! TANTANGAN 100% ADVANCEMENT MINECRAFT! Part 11,205595,8451,2020-08-19T22:24:02Z,PT4H36M15S,1
5499,Windah Basudara,SUDAH BUKAN BAYANGAN! NAMATIN Shadow Fight 3 #2 (Part 1 di Charity),490155,13316,2020-08-19T16:13:37Z,PT1H29M35S,1
5500,Windah Basudara,BAYANGAN JUGA MANUSIA! NAMATIN Shadow Fight 2 #3,838826,23363,2020-08-19T14:58:59Z,PT4H43M27S,1
5501,Windah Basudara,MAMA DIKIT LAGI YAH TOP UPNYA! NAMATIN Asphalt 8 #3,182442,7060,2020-08-19T09:41:46Z,PT1H18M53S,1
5502,Windah Basudara,MAMA AKU BALAPAN DI PANTAI LAGI YAH! NAMATIN Beach Buggy Racing 2 #3,213999,7213,2020-08-19T08:13:03Z,PT1H6M2S,1
5503,Windah Basudara,EMASIN SEMUA MOBIL! MENUJU 100% BEACH BUGGY RACING #3,305679,10477,2020-08-19T04:08:46Z,PT1H41M42S,1
5504,Windah Basudara,Livestreaming Charity Main Game Random 24 Jam Untuk Masamba SESI 3,733318,23868,2020-08-17T13:16:57Z,PT8H5M54S,1
5505,Windah Basudara,Livestreaming Charity Main Game Random 24 Jam Untuk Masamba SESI 2,551419,20288,2020-08-17T05:09:09Z,PT8H5M29S,1
5506,Windah Basudara,Livestreaming Charity Main Game Random 24 Jam Untuk Masamba SESI 1,814830,30434,2020-08-16T20:49:39Z,PT8H2M39S,1
5507,Windah Basudara,GOKIL WINSTREAK! Kompilasi Booyah Menuju 10 Mahkota - Fall Guys,382799,15882,2020-08-16T09:05:10Z,PT18M45S,0
5508,Windah Basudara,MAMA AKU TOP UP DIKIT AJA YAH BUAT MOBIL BARU! NAMATIN Asphalt 8 #2,231791,9579,2020-08-15T17:54:21Z,PT1H32M9S,1
5509,Windah Basudara,BAYANGAN JUGA MANUSIA! NAMATIN Shadow Fight 2 #2,921470,28630,2020-08-15T16:07:56Z,PT2H26M12S,1
5510,Windah Basudara,MAMA AKU BALAPAN DI PANTAI LAGI YAH! NAMATIN Beach Buggy Racing 2 #2,284315,8507,2020-08-15T06:25:09Z,PT1H2M27S,1
5511,Windah Basudara,EMASIN SEMUA MOBIL! MENUJU 100% BEACH BUGGY RACING #2,304545,9681,2020-08-15T05:04:07Z,PT1H18M16S,1
5512,Windah Basudara,KEDELAI DIMANA KAU! TANTANGAN 100% ADVANCEMENT MINECRAFT! Part 10,122537,6160,2020-08-14T17:48:44Z,PT58M39S,1
5513,Windah Basudara,MAMA GAME MOBIL GRAPIKNYA KEREN AMAT! NAMATIN Asphalt 8 #1,252593,9426,2020-08-14T15:45:06Z,PT58M32S,1
5514,Windah Basudara,BAYANGAN JUGA MANUSIA! NAMATIN Shadow Fight 2 #1,808526,25641,2020-08-14T14:45:18Z,PT1H35M51S,1
5515,Windah Basudara,MAMA AKU BALAPAN DI PANTAI LAGI YAH! NAMATIN Beach Buggy Racing 2 #1,629384,17258,2020-08-14T09:57:38Z,PT1H50M18S,1
5516,Windah Basudara,EMASIN SEMUA MOBIL! MENUJU 100% BEACH BUGGY RACING #1,311471,9899,2020-08-14T07:54:05Z,PT1H10M23S,1
5517,Windah Basudara,minecraft pertanda...,938951,21881,2020-08-13T19:27:40Z,PT3H14M9S,1
5518,Windah Basudara,TAMAT HARI INI! SELAMAT TINGGAL BOCAH PANTAI! Beach Buggy Racing,563342,19824,2020-08-13T10:10:03Z,PT1H18M42S,1
5519,Windah Basudara,BARBAR 10 MAHKOTA! NGA BOOYAH NGA PULANG! Fall Guys: Ultimate Knockout,550185,17177,2020-08-13T06:20:50Z,PT2H17M47S,1
5520,Windah Basudara,MAKAN SEMUA MAKANAN! TANTANGAN 100% ADVANCEMENT MINECRAFT! Part 9,188617,7938,2020-08-12T19:26:36Z,PT2H1M17S,1
5521,Windah Basudara,MAMA AKU BALAPAN DI PANTAI DULU YAH! NAMATIN Beach Buggy Racing #6,506981,19061,2020-08-12T15:52:21Z,PT2H14M18S,1
5522,Windah Basudara,NGA AKAN PULANG DARI RENTAL SAMPE BOOYAH! Fall Guys: Ultimate Knockout,1447384,30971,2020-08-12T12:53:24Z,PT2H57M,1
5523,Windah Basudara,MAMA AKU BALAPAN DI PANTAI DULU YAH! NAMATIN Beach Buggy Racing #5,325268,13155,2020-08-12T08:13:03Z,PT1H11M26S,1
5524,Windah Basudara,TAMAT HARI INI! MENUJU 173 GOLD TANPA TOXIC! Burnout 3,124302,7495,2020-08-12T05:57:46Z,PT46M43S,1
5525,Windah Basudara,Game .EXE Katanya Membuat KEMATIAN!! NAMATIN Game .EXE,527002,21843,2020-08-11T16:18:40Z,PT13M46S,1
5526,Windah Basudara,TARGET 160 GOLD TANPA TOXIC! NAMATIN Burnout 3,92533,5351,2020-08-11T06:54:56Z,PT55M1S,1
5527,Windah Basudara,"SIALAN LUPA NGE SAVE, LAWAN BOTAK LAGI! NAMATIN Undertale Genocide ENDING",258215,8397,2020-08-10T17:39:30Z,PT1H3M22S,1
5528,Windah Basudara,3 MONSTER TERAKHIR! TANTANGAN 100% ADVANCEMENT MINECRAFT! Part 8,222476,10168,2020-08-10T15:59:43Z,PT2H2M40S,1
5529,Windah Basudara,TEORI MOBIL EMAS! NAMATIN Beach Buggy Racing #4,747308,20135,2020-08-10T11:05:36Z,PT1H20M24S,1
5530,Windah Basudara,TAMAT QUEST UTAMA! Dying Light,205208,7524,2020-08-10T00:52:12Z,PT2H36M49S,1
5531,Windah Basudara,KITA BANTAI SEMUA MONSTER! NAMATIN Undertale Genocide PART 4,204436,6155,2020-08-09T21:39:44Z,PT3H29M34S,1
5532,Windah Basudara,TANTANGAN 100% ADVANCEMENT MINECRAFT! Part 7,228671,8943,2020-08-09T13:22:58Z,PT1H55M26S,1
5533,Windah Basudara,MAMA AKU BALAPAN DI PANTAI DULU YAH! NAMATIN Beach Buggy Racing #3,254115,9361,2020-08-09T10:25:26Z,PT1H15M,1
5534,Windah Basudara,KITA BANTAI SEMUA MONSTER! NAMATIN Undertale Genocide PART 3,81064,2522,2020-08-08T18:14:27Z,PT31M44S,1
5535,Windah Basudara,KITA BANTAI SEMUA MONSTER! NAMATIN Undertale Genocide PART 2,123711,4261,2020-08-08T17:43:32Z,PT1H26M24S,1
5536,Windah Basudara,Akhirnya Booyah Dan Pensiun. NAMATIN Fall Guys: Ultimate Knockout,265018,8386,2020-08-08T15:55:09Z,PT1H41M53S,1
5537,Windah Basudara,Kalo Booyah Berarti TAMAT! NAMATIN Fall Guys: Ultimate Knockout,171829,6011,2020-08-08T13:59:26Z,PT1H25M32S,1
5538,Windah Basudara,AYO COMEBACK! TEORI AFK FISHING 1.16 Minecraft?,186635,7357,2020-08-08T11:45:39Z,PT2H26M35S,1
5539,Windah Basudara,MAMA AKU BALAPAN DI PANTAI DULU YAH! NAMATIN Beach Buggy Racing #2,249496,10169,2020-08-08T07:18:13Z,PT1H7M41S,1
5540,Windah Basudara,BARBAR 140 GOLD TANPA TOXIC! NAMATIN Burnout 3,57947,2960,2020-08-08T04:12:50Z,PT1H7M44S,1
5541,Windah Basudara,TAMAT HARI INI! Final Fantasy VII Crisis Core,47452,2119,2020-08-07T23:50:47Z,PT1H50M35S,1
5542,Windah Basudara,TAMAT HARI INI! Destroy All Humans!,30744,1606,2020-08-07T20:59:10Z,PT1H30M36S,1
5543,Windah Basudara,GAME INI BISA TAMAT NGA SIH? Fall Guys: Ultimate Knockout,146622,6616,2020-08-07T17:46:44Z,PT1H17M43S,1
5544,Windah Basudara,KITA BANTAI SEMUA MONSTER! NAMATIN Undertale Genocide PART 1,121342,4442,2020-08-05T14:28:47Z,PT1H8S,1
5545,Windah Basudara,MAMA AKU BALAPAN DI PANTAI DULU YAH! NAMATIN Beach Buggy Racing #1,430785,15680,2020-08-05T13:14:13Z,PT48M5S,1
5546,Windah Basudara,istirahat dari minecraft sejenak.... TAPI TENANNG GAK PENSIUN!,166309,7038,2020-08-05T08:18:22Z,PT1H7M29S,1
5547,Windah Basudara,TARGET 120 GOLD TANPA TOXIC! NAMATIN Burnout 3,68328,3311,2020-08-05T05:53:36Z,PT1H24M43S,1
5548,Windah Basudara,RPG Pagi Pagi! NAMATIN Final Fantasy VII Crisis Core,47430,2574,2020-08-05T03:12:17Z,PT1H36M27S,1
5549,Windah Basudara,ALIEN SEBENTAR LAGI MENYERANG INDONESIA! NAMATIN Destroy All Humans! #5,27430,1564,2020-08-04T20:13:02Z,PT1H4M34S,1
5550,Windah Basudara,TANTANGAN 100% ADVANCEMENT MINECRAFT! Part 7,150036,6166,2020-08-04T16:37:32Z,PT1H8M31S,1
5551,Windah Basudara,TEORI MULTIPLAYER DAN SENJATA DEWA! NAMATIN Dying Light PART 10,118230,4024,2020-08-04T11:07:46Z,PT1H28M48S,1
5552,Windah Basudara,KITA LANJUT PERJALANAN ZACK! NAMATIN Final Fantasy VII Crisis Core,38025,1752,2020-08-03T23:32:39Z,PT2H13M34S,1
5553,Windah Basudara,ALIEN SEBENTAR LAGI MENYERANG INDONESIA! NAMATIN Destroy All Humans! #4,26086,1398,2020-08-03T20:45:17Z,PT1H38M26S,1
5554,Windah Basudara,TANTANGAN 100% ADVANCEMENT MINECRAFT! Part 6,272345,9664,2020-08-03T17:21:47Z,PT1H56M45S,1
5555,Windah Basudara,PERAMPOK INI KOCAK! NAMATIN Scary Robber Home Clash,93131,4222,2020-08-03T14:59:06Z,PT1H26M19S,1
5556,Windah Basudara,Semua DUEL/ BOSS Ghost of Tsushima! INILAH SENI SAMURAI!,89445,5892,2020-08-03T11:02:14Z,PT23M10S,0
5557,Windah Basudara,TARGET 110 GOLD TANPA TOXIC! NAMATIN Burnout 3,90921,4313,2020-08-03T06:48:30Z,PT1H39M20S,1
5558,Windah Basudara,PUSH SIDEQUEST DAN TEORI SENJATA DEWA! NAMATIN Dying Light PART 9,189235,5357,2020-08-02T18:42:30Z,PT3H4M49S,1
5559,Windah Basudara,TANTANGAN 100% ADVANCEMENT MINECRAFT! Part 5,436096,12345,2020-08-02T13:26:41Z,PT3H10M52S,1
5560,Windah Basudara,GURU JAHAT KEMBALI LAGI! NAMATIN Scary Teacher 3D,102564,4100,2020-08-02T09:31:23Z,PT1H5M26S,1
5561,Windah Basudara,TAMAT! MELAWAN PAMAN SENDIRI! Ghost of Tsushima,132560,5611,2020-08-02T02:57:36Z,PT2H31M5S,1
5562,Windah Basudara,Game .EXE Katanya Membuat SAKIT!! NAMATIN Game .EXE,209348,8775,2020-08-01T15:59:45Z,PT18M3S,1
5563,Windah Basudara,ZOMBIE BOCIL NANGIS! NAMATIN Dying Light PART 8,102722,3625,2020-08-01T13:55:38Z,PT1H16M22S,1
5564,Windah Basudara,ALIEN SEBENTAR LAGI MENYERANG INDONESIA! NAMATIN Destroy All Humans! #3,42863,2135,2020-08-01T11:21:04Z,PT59M15S,1
5565,Windah Basudara,AKU BELUM MENYERAH! TANTANGAN 100% ADVANCEMENT MINECRAFT! Part 4,204210,7852,2020-08-01T10:01:57Z,PT2H49M52S,1
5566,Windah Basudara,"selamat tinggal semua, terima kasih MINECRAFT",191101,7914,2020-08-01T04:24:08Z,PT1H53M39S,1
5567,Windah Basudara,MENUJU TAHUN KE 2! Harvest Moon Remake,77490,2813,2020-07-31T04:56:38Z,PT1H37M28S,1
5568,Windah Basudara,APA ITU SAMURAI? BIAR KUNAI YANG BERBICARA! NAMATIN Ghost of Tsushima,79763,3337,2020-07-31T03:13:50Z,PT1H57M35S,1
5569,Windah Basudara,TAMAT! ALIEN TENTAKEL Carrion,86229,3398,2020-07-30T17:34:29Z,PT1H21M26S,1
5570,Windah Basudara,ALIEN SEBENTAR LAGI MENYERANG INDONESIA! NAMATIN Destroy All Humans! #2,66842,2902,2020-07-30T14:18:08Z,PT1H25M11S,1
5571,Windah Basudara,TANTANGAN 100% ADVANCEMENT MINECRAFT! Part 3,153949,6421,2020-07-30T10:40:36Z,PT1H40M33S,1
5572,Windah Basudara,PETUALANGAN ANAK KICIK LAWAN SERANGGA! NYOBA GROUNDED!,143132,5712,2020-07-30T08:48:37Z,PT2H28M49S,1
5573,Windah Basudara,ALIEN SEBENTAR LAGI MENYERANG INDONESIA! NAMATIN Destroy All Humans! #1,131540,6120,2020-07-29T08:02:21Z,PT1H8M39S,1
5574,Windah Basudara,HARUS SAMPAI 100 GOLD TANPA TOXIC! NAMATIN Burnout 3,146373,6365,2020-07-29T06:45:22Z,PT2H45M59S,1
5575,Windah Basudara,AYO PUSH SEMUA QUEST! NAMATIN Ghost of Tsushima,100082,4401,2020-07-29T03:41:21Z,PT3H17M8S,1
5576,Windah Basudara,ZOMBIE KOK SPIDERMAN! NAMATIN Dying Light PART 7,123037,4652,2020-07-28T15:16:01Z,PT1H42M30S,1
5577,Windah Basudara,Game .EXE Katanya Membuat SINTING!! NAMATIN Game .EXE,1104355,41650,2020-07-28T11:06:10Z,PT17M27S,1
5578,Windah Basudara,ALIEN TENTAKEL KEMBALI LAGI! NAMATIN Carrion PART 3,89113,3718,2020-07-28T10:23:23Z,PT1H28M40S,1
5579,Windah Basudara,Woody dan Buzz - NAMATIN Toy Story 3.EXE (BAD ENDING),486414,17262,2020-07-28T08:03:51Z,PT53M42S,1
5580,Windah Basudara,TANTANGAN 100% ADVANCEMENT MINECRAFT! Part 2,184691,8536,2020-07-28T04:06:02Z,PT1H40M31S,1
5581,Windah Basudara,AYO EXPLORE SEMUA TEMPAT DUNIA SAMURAI! NAMATIN Ghost of Tsushima,140602,6058,2020-07-27T05:06:18Z,PT4H39M34S,1
5582,Windah Basudara,TANTANGAN 100% ADVANCEMENT MINECRAFT! Part 1,155118,6758,2020-07-26T17:23:26Z,PT1H9M41S,1
5583,Windah Basudara,Game .EXE Katanya Membuat MATI! NAMATIN Game .EXE,516534,19304,2020-07-26T13:23:21Z,PT15M8S,1
5584,Windah Basudara,TAMAT ENDING KEBAIKAN! - Undertale,563878,15396,2020-07-26T11:30:02Z,PT2H19M33S,1
5585,Windah Basudara,ZOMBIE DI LONCATIN! NAMATIN Dying Light PART 6,153587,5826,2020-07-26T06:16:16Z,PT1H56M15S,1
5586,Windah Basudara,Game .EXE Katanya Membuat SINTING! NAMATIN Game .EXE,675259,25428,2020-07-26T01:51:27Z,PT32M42S,1
5587,Windah Basudara,ALIEN TENTAKEL MEMANGSA MANUSIA! NAMATIN Carrion PART 2,82013,3585,2020-07-25T10:55:28Z,PT1H1M28S,1
5588,Windah Basudara,BOSS APA LAGI YANG AKAN KITA LAWAN! NAMATIN Undertale PART 5,118227,3900,2020-07-25T09:08:51Z,PT58M30S,1
5589,Windah Basudara,ALIEN TELEPATI KEMBALI! NAMATIN Foreign Creature 2,287908,9835,2020-07-25T05:24:56Z,PT44M26S,1
5590,Windah Basudara,CITA-CITA KU JADI SAMURAI! NAMATIN Ghost of Tsushima,75481,3604,2020-07-25T02:56:55Z,PT2H9M36S,1
5591,Windah Basudara,KITA COBA SENJATA DEWA LAWAN ZOMBIE! NAMATIN Dying Light PART 5,106100,3786,2020-07-24T17:37:53Z,PT1H38M40S,1
5592,Windah Basudara,APAKAH SPONGEBOB JELMAAN SETAN? NAMATIN Game Spongebob Horror,504250,16699,2020-07-24T15:31:49Z,PT13M12S,1
5593,Windah Basudara,MONSTER ITU BAIK ATAU JAHAT? NAMATIN Undertale PART 4,98267,3659,2020-07-24T14:31:35Z,PT1H11M41S,1
5594,Windah Basudara,ALIEN TIPE BARU APA LAGI INI!? NAMATIN Foreign Creature,297643,10543,2020-07-24T12:26:56Z,PT21M21S,1
5595,Windah Basudara,ALIEN TENTAKEL PEMAKAN MANUSIA! NAMATIN Carrion PART 1,213412,8415,2020-07-24T10:36:38Z,PT1H18M57S,1
5596,Windah Basudara,MENJELAJAHI DUNIA SAMURAI! NAMATIN Ghost of Tsushima,104387,4495,2020-07-24T00:50:54Z,PT3H29M47S,1
5597,Windah Basudara,Game .EXE Katanya Membawa VIRUS! NAMATIN Game .EXE,443141,17723,2020-07-23T14:56:43Z,PT11M29S,1
5598,Windah Basudara,ENDING RAHASIA TERUNGKAP HARI INI! NAMATIN 100% Spongebob Rehydrated,236904,8052,2020-07-23T13:38:20Z,PT29M20S,1
5599,Windah Basudara,BAPAK KAU SAMURAI! NAMATIN Ghost of Tsushima,117836,5579,2020-07-23T07:17:39Z,PT1H59M26S,1
5600,Windah Basudara,SENJATA DEWA UNTUK LAWAN ZOMBIE HARUS JADI! NAMATIN Dying Light PART 4,177510,6831,2020-07-23T04:51:13Z,PT2H17M30S,1
5601,Windah Basudara,Game .EXE Katanya Membuat GILA! NAMATIN GAME .EXE,1659716,56632,2020-07-22T14:31:32Z,PT19M44S,1
5602,Windah Basudara,ALIEN CACING KEMBALI LAGI! NAMATIN The Visitor,2183117,48854,2020-07-22T13:13:23Z,PT50M2S,1
5603,Windah Basudara,APAKAH ENDING RAHASIA ITU NYATA? Menuju 100%! Spongebob Rehydrated #5,270621,13582,2020-07-22T10:36:00Z,PT2H16M23S,1
5604,Windah Basudara,KE ISTANA MONSTER! - NAMATIN UNDERTALE PART 3,123988,5164,2020-07-22T06:22:50Z,PT1H28M31S,1
5605,Windah Basudara,GOLDEN SHADOW IS BACK! NAMATIN Ghost of Tsushima,81794,3843,2020-07-21T18:33:32Z,PT2H8M53S,1
5606,Windah Basudara,APAKAH ENDING RAHASIA ITU NYATA? Menuju 100%! Spongebob Rehydrated #4,197503,6332,2020-07-21T15:39:21Z,PT2H9M40S,1
5607,Windah Basudara,6 JAM JADI SAMURAi! NAMATIN Ghost of Tsushima,186589,7668,2020-07-21T02:56:54Z,PT6H18M9S,1
5608,Windah Basudara,CARI SENJATA DEWA UNTUK LAWAN ZOMBIE! NAMATIN Dying Light PART 3,164409,5991,2020-07-20T15:41:35Z,PT2H11M24S,1
5609,Windah Basudara,Room Tour 1 Juta Subs & Unboxing Gold Play Button Windah Basudara,1123276,68281,2020-07-20T12:44:16Z,PT26M13S,0
5610,Windah Basudara,ALIEN CACING INI KATANYA SADIS! NAMATIN The Visitor,802087,25346,2020-07-20T10:55:56Z,PT47M44S,1
5611,Windah Basudara,APAKAH ENDING RAHASIA ITU NYATA? Menuju 100%! Spongebob Rehydrated #3,178919,5986,2020-07-20T09:25:15Z,PT2H8M51S,1
5612,Windah Basudara,"Mencari Burung, Rubah, Angin - NAMATIN Ghost of Tsushima PART 3",58477,2155,2020-07-19T22:01:20Z,PT2H12M39S,1
5613,Windah Basudara,Jadi Sebenarnya Siapa Yang Jahat? - NAMATIN UNDERTALE PART 2,117046,3643,2020-07-19T18:15:15Z,PT1H21M23S,1
5614,Windah Basudara,MENJELAJAHI DUNIA SAMURAI! NAMATIN Ghost of Tsushima PART 2,108787,4476,2020-07-19T15:35:46Z,PT2H6M15S,1
5615,Windah Basudara,ZOMBIE KOK PARKOUR! NAMATIN Dying Light PART 2,161126,5992,2020-07-19T11:11:11Z,PT1H47M4S,1
5616,Windah Basudara,APAKAH ENDING RAHASIA ITU NYATA? Menuju 100%! Spongebob Rehydrated #2,261427,7624,2020-07-19T08:26:47Z,PT2H8M52S,1
5617,Windah Basudara,TARGET 85 GOLD NO TOXIC! NAMATIN Burnout 3,91434,4012,2020-07-18T03:24:48Z,PT45M48S,1
5618,Windah Basudara,Lanjut Petualangan Zack - NAMATIN Final Fantasy VII Crisis Core,30744,1564,2020-07-18T01:00:51Z,PT1H30M55S,1
5619,Windah Basudara,Katanya Game Ini Ceritanya Bagus - NAMATIN UNDERTALE PART 1,171897,5371,2020-07-17T21:48:17Z,PT1H9M37S,1
5620,Windah Basudara,KIAMAT ZOMBIE APALAGI INI! NAMATIN Dying Light PART 1,327556,8701,2020-07-17T19:59:52Z,PT1H28M57S,1
5621,Windah Basudara,SAMURAI ADALAH JALAN HIDUPKU! NAMATIN Ghost of Tsushima PART 1,196467,7087,2020-07-17T17:48:05Z,PT2H26M50S,1
5622,Windah Basudara,Lengkapin Tool Netherite Dan Sedikit Building - Minecraft,237560,9089,2020-07-17T14:32:56Z,PT1H47M15S,1
5623,Windah Basudara,game toy story pertama di dunia.,84157,3632,2020-07-17T10:30:02Z,PT1H17M20S,1
5624,Windah Basudara,APAKAH ENDING RAHASIA ITU NYATA? Menuju 100%! Spongebob Rehydrated #1,2019187,41814,2020-07-17T05:28:30Z,PT2H11M1S,1
5625,Windah Basudara,Melawan Wither Dengan Netherite! - Minecraft,412332,16879,2020-07-17T02:35:00Z,PT10M9S,0
5626,Windah Basudara,ROBLOX GAME KESUKAAN KU APALAGI YANG MODE PARKOUR PETUALANGAN,246520,9134,2020-07-17T01:57:53Z,PT1H43M13S,1
5627,Windah Basudara,"Melawan Mantan Carl Johnson, Catalina! - Grand Theft Auto III",296992,8663,2020-07-15T17:01:15Z,PT10M6S,0
5628,Windah Basudara,KITA AKHIRNYA SAMPAI! Harumkan Indonesia! - Roblox Expedition Antarctica,192284,9473,2020-07-14T12:20:58Z,PT16M26S,0
5629,Windah Basudara,Boruto Melawan Hokage Naruto! - Naruto Ultimate Ninja Storm 4,1590003,35735,2020-07-14T10:24:23Z,PT12M31S,0
5630,Windah Basudara,ASIK PERJALANAN KITA JADI SANTAI! - Roblox Expedition Antarctica,91477,4375,2020-07-14T01:33:21Z,PT12M9S,0
5631,Windah Basudara,METAL SLUG PALING SERU DI PS2 KITA TAMATKAN! - Metal Slug 3,158723,4714,2020-07-13T15:56:33Z,PT1H2M,0
5632,Windah Basudara,Melawan Ender Dragon & Menamatkan Minecraft!,569896,22291,2020-07-11T17:04:59Z,PT19M26S,0
5633,Windah Basudara,METAL SLUG TERAKHIR DI PS2 KITA TAMATKAN! - Metal Slug 6,208990,5701,2020-07-10T13:57:52Z,PT52M5S,0
5634,Windah Basudara,GUNUNG KEMATIAN MEMAKAN BANYAK KORBAN! - Roblox Expedition Antarctica,133293,6086,2020-07-10T13:57:49Z,PT21M4S,0
5635,Windah Basudara,NOSTALGIA GINI AMAT! TETAP LANGSUNG KITA TAMATKAN - Metal Slug 5,135623,4986,2020-07-08T13:32:28Z,PT40M58S,0
5636,Windah Basudara,10 YOUTUBER PERGI MENDAKI BERSAMA! - Roblox Expedition Antarctica,370519,15730,2020-07-08T12:58:35Z,PT22M4S,0
5637,Windah Basudara,METAL SLUG PERTAMA DI DUNIA KITA TAMATKAN! - Metal Slug 1,151635,5905,2020-07-07T16:40:19Z,PT29M58S,0
5638,Windah Basudara,Game Favorite Anak Indonesia! GREGET BANGET! - Roblox Tower Of Hell,215133,9394,2020-07-06T17:51:28Z,PT15M3S,0
5639,Windah Basudara,MELAWAN RAID PILLAGER & MENDAPATKAN TOTEM OF UNDYING! - Minecraft,399055,16463,2020-07-06T17:16:10Z,PT16M48S,0
5640,Windah Basudara,"Melawan Semua Boss Di Game LAST OF US 2, DARI MANUSIA SAMPAI ZOMBIE!",107920,6897,2020-07-05T13:50:20Z,PT30M8S,0
5641,Windah Basudara,METAL SLUG TERBAIK DI PLAYSTATION KITA TAMATKAN! - Metal Slug X,188204,7639,2020-07-04T01:33:30Z,PT43M38S,0
5642,Windah Basudara,JOEL DAN PERJUANGAN TERAKHIRNYA - Last of Us 1 ENDING,57629,3514,2020-07-04T01:30:42Z,PT47M23S,0
5643,Windah Basudara,PERNAH DIBULLY DAN JADI PELAYAN? - DRAW MY LIFE WINDAH BASUDARA,2925794,183226,2020-07-02T16:39:15Z,PT24M11S,0
5644,Windah Basudara,AKHIR PERJALANAN STAR LORD! NAMATIN Guardians of the Galaxy PART 5,70447,3191,2020-07-01T03:24:25Z,PT1H40M4S,1
5645,Windah Basudara,ZACK BERTEMU DENGAN AERITH! NAMATIN Final Fantasy VII Crisis Core,27568,1310,2020-07-01T00:22:54Z,PT1H10M35S,1
5646,Windah Basudara,Menyelesaikan Teori Sayap! Terraria HARD MODE,86586,2661,2020-06-30T19:50:50Z,PT3H1M25S,1
5647,Windah Basudara,AKU NGA NGERTI RLCRAFT!,289806,10985,2020-06-30T15:52:11Z,PT2H16M21S,1
5648,Windah Basudara,JANGAN MERUBAH TAKDIR! NAMATIN Guardians of the Galaxy PART 4,52668,2520,2020-06-30T12:03:59Z,PT1H50M32S,1
5649,Windah Basudara,GAME KESUKAAN ANAK INDONESIA! Roblox,177817,6805,2020-06-30T07:42:22Z,PT1H29M18S,1
5650,Windah Basudara,BAPAK KAU THANOS! NAMATIN Guardians of the Galaxy PART 3,39804,1906,2020-06-29T17:32:21Z,PT1H26M3S,1
5651,Windah Basudara,BIAR 2 DIMENSI YANG PENTING SERU! Terraria,83840,2937,2020-06-29T13:07:32Z,PT2H11M42S,1
5652,Windah Basudara,TAMAT! KENAPA SEMUA ORANG JADI GENDUT!? WALL-E,114376,4278,2020-06-29T09:50:16Z,PT2H16M50S,1
5653,Windah Basudara,TARGET GENAPIN GOLD NO TOXIC! NAMATIN Burnout 3,78495,3279,2020-06-29T03:56:51Z,PT1H41M8S,1
5654,Windah Basudara,BALAPAN PAGI CERIA TARGET 65 GOLD NO TOXIC! NAMATIN Burnout 3,68283,2578,2020-06-28T03:39:19Z,PT1H52M5S,1
5655,Windah Basudara,GRINDING MENUJU PIRATE LORD EX Pink Pieces! Sea of Thives,69009,2277,2020-06-27T20:52:19Z,PT2H19M2S,1
5656,Windah Basudara,TAMAT! ORANG BAIK PUN BISA BERBUAT KESALAHAN! Last of Us 2,339311,10320,2020-06-27T18:19:56Z,PT2H29M41S,1
5657,Windah Basudara,TEORI FULL SET NETHERITE DAN RLcraft! Minecraft,216849,7915,2020-06-27T15:11:21Z,PT2H1M19S,1
5658,Windah Basudara,NAMATIN Metal Slug 4 with Argha Kudo!,95766,3543,2020-06-27T10:15:29Z,PT46M48S,1
5659,Windah Basudara,SIAPAKAH IBU STAR LORD? NAMATIN Guardians of the Galaxy PART 2,46504,2381,2020-06-27T07:51:20Z,PT1H19M14S,1
5660,Windah Basudara,PETUALANGAN ROBOT SAMPAH - NAMATIN WALL-E,81550,3668,2020-06-27T04:46:33Z,PT1H6M19S,1
5661,Windah Basudara,DENDAM TIDAK AKAN MENYELESAIKAN MASALAH! NAMATIN Last of Us 2 PART 8,157499,4923,2020-06-25T18:02:41Z,PT2H5M45S,1
5662,Windah Basudara,MENCOBA TEORI NETHER UPDATE dan ANCIENT DEBRIS! Minecraft,327777,11863,2020-06-25T15:38:04Z,PT1H49M2S,1
5663,Windah Basudara,Minecraft Dan Terraria SAMA BAGUSNYA! Terraria,78827,3092,2020-06-25T13:47:34Z,PT1H35M23S,1
5664,Windah Basudara,DENDAM TIDAK AKAN MENYELESAIKAN MASALAH! NAMATIN Last of Us 2 PART 7,215002,6255,2020-06-24T18:14:39Z,PT2H43M34S,1
5665,Windah Basudara,APAKAH LUAR ANGKASA ITU NYATA? NAMATIN Guardians of the Galaxy PART 1,93339,4267,2020-06-24T15:05:09Z,PT1H31M52S,1
5666,Windah Basudara,IBU MIMPI KU JADI JACK SPARROW! GRINDING SANTUY! Sea of Thieves,327841,6967,2020-06-24T10:51:08Z,PT3H34M7S,1
5667,Windah Basudara,SOSOK WANITA PETARUNG! NAMATIN Last of Us 2 PART 6,186588,5533,2020-06-23T18:16:02Z,PT2H51M26S,1
5668,Windah Basudara,TOURNAMENT TERAKHIR! SENJATA DAN ARMOR LENGKAP! Sengoku Basara 2 Heroes GAMEPLAY #23,60173,2463,2020-06-23T13:55:30Z,PT1H12M33S,1
5669,Windah Basudara,SKIN TERKEREN ROCKET! 500 RIBU RUPIAH CUKUPKAH?  - MARVEL Super War,106527,6686,2020-06-23T07:44:33Z,PT10M32S,0
5670,Windah Basudara,SETELAH 1 TAHUN AKHIRNYA TAMAT! Final Fantasy X,70638,2658,2020-06-22T23:43:25Z,PT3H27M12S,1
5671,Windah Basudara,SOSOK WANITA PETARUNG! NAMATIN Last of Us 2 PART 5,162593,5185,2020-06-22T17:16:23Z,PT2H11S,1
5672,Windah Basudara,PERJUANGAN ELLIE DAN DINA! NAMATIN Last of Us 2 PART 4,177852,4979,2020-06-21T17:46:39Z,PT2H45M46S,1
5673,Windah Basudara,MINECRAFT DAN TERRARIA BERTEMAN! TAPI MAIN TERRARIA DULU YUK!,91567,3339,2020-06-21T14:33:43Z,PT2H8M10S,1
5674,Windah Basudara,TAMAT! MAKIN SADIS ANAK KECIL MINGGIR! Until Dawn,136291,5262,2020-06-21T09:15:16Z,PT1H57M11S,1
5675,Windah Basudara,PERJUANGAN ELLIE DAN DINA! NAMATIN Last of Us 2 PART 3,160385,5243,2020-06-21T05:16:37Z,PT1H59M38S,1
5676,Windah Basudara,ZOMBIE JAMUR KEMBALI! NAMATIN Last of Us 2 PART 2,272047,6924,2020-06-20T17:13:54Z,PT4H25M28S,1
5677,Windah Basudara,MAKIN SADIS ANAK KECIL MINGGIR! NAMATIN Until Dawn PART 4,116049,4965,2020-06-20T04:39:40Z,PT1H23M42S,1
5678,Windah Basudara,Grinding Menuju Pirate Lord! Sea of Thieves,284715,6140,2020-06-19T18:04:26Z,PT3H1M37S,1
5679,Windah Basudara,DAPETIN ARMOR TOURNAMENT LEVEL 50 SISA! Sengoku Basara 2 Heroes GAMEPLAY #22,70380,2812,2020-06-19T15:09:30Z,PT1H30M13S,1
5680,Windah Basudara,ZOMBIE JAMUR KEMBALI! NAMATIN Last of Us 2 PART 1,258316,7977,2020-06-19T10:35:28Z,PT2H7M31S,1
5681,Windah Basudara,MASA LALU ELLIE! NAMATIN Last of Us Left Behind,96588,3774,2020-06-19T05:18:47Z,PT1H49M15S,1
5682,Windah Basudara,MENCOBA TEORI DUNIA ANGKASA DAN DUNGEON! Terraria,73527,3196,2020-06-19T02:06:04Z,PT1H41M38S,1
5683,Windah Basudara,MAKHLUK APA LAGI INI!? NAMATIN Until Dawn PART 4,64039,2969,2020-06-18T23:51:45Z,PT51M11S,1
