,channel,title,view_count,like_count,upload_date,duration,was_live
0,Erpan1140,PLAYER API GRATIS SEMAKIN DIDEPAN!!,86075,5406,2023-06-05T09:59:06Z,PT19M30S,0
1,Erpan1140,HARTA TAHTA KABIR!!,127382,7405,2023-06-04T12:56:10Z,PT23M18S,0
2,Erpan1140,MANUSIA MANUSIA ANEHâ€¦,155046,7341,2023-05-31T15:49:32Z,PT11M32S,0
3,Erpan1140,SEPEDA SIAPA TU MANNNN!!!,255042,10532,2023-05-28T10:12:42Z,PT17M40S,0
4,Erpan1140,TUTORIAL NONTON COLDPLAY GRATIS!,270135,11139,2023-05-27T07:55:47Z,PT14M4S,0
5,Erpan1140,KUKIRA CUPU TERNYATA BRAND AMBASADOR!,274248,10642,2023-05-25T10:33:19Z,PT19M56S,0
6,Erpan1140,MAJU !!MAJU !!MAJU!!!,282732,12946,2023-05-23T14:27:22Z,PT19M40S,0
7,Erpan1140,AKU INGIN HIDUP DIDUNIA ANIMEK!,288838,11090,2023-05-17T14:43:00Z,PT14M17S,0
8,Erpan1140,HIDUP INI HANYALAH ILUSI SEMATA!,278246,10949,2023-05-13T10:01:26Z,PT17M14S,0
9,Erpan1140,KALIAN SEMUA MINGGIR!!,275098,11180,2023-05-11T09:01:09Z,PT15M17S,0
10,Erpan1140,BENDA BENDA APA YG SUKA NGAMUK ???,381382,14255,2023-05-06T10:26:06Z,PT22M17S,0
11,Erpan1140,SENJATA TERKUAT DI ALAM SEMESTA! - RAGNAROK ORIGIN #2,41184,1440,2023-05-04T09:00:38Z,PT17M15S,0
12,Erpan1140,KEKUATAN PARA WARGA FRINDAFUN!,240481,9002,2023-05-04T03:38:27Z,PT17M35S,0
13,Erpan1140,ISINYA HANYA KUFRA REVAMP!!,322178,12554,2023-05-01T10:00:15Z,PT15M23S,0
14,Erpan1140,KISAH CINTA UNTUK STAR TREK!,271394,11810,2023-04-30T00:44:01Z,PT14M19S,0
15,Erpan1140,YG GA NONTON GEY!! - RAGNAROK ORIGIN,64070,2273,2023-04-25T11:43:26Z,PT14M23S,0
16,Erpan1140,AKHIRNYA JADI ORANG TERKAYA DI BUMI!!,88568,3622,2023-04-24T12:09:48Z,PT19M11S,0
17,Erpan1140,APAPUN KANKULAKUKAN DEMI WANITA TERCYNTA!,331983,12517,2023-04-16T09:55:55Z,PT14M29S,0
18,Erpan1140,CINTA KANDAS MADAFRAPUN DIGAS!!,556919,18203,2023-04-15T08:57:04Z,PT13M8S,0
19,Erpan1140,MOBEL LEJEN LIFE ACTION!,329920,12969,2023-04-12T09:16:15Z,PT13M17S,0
20,Erpan1140,PERKARA MENCARI TAKJIL!!,368885,15252,2023-04-10T10:19:10Z,PT16M50S,0
21,Erpan1140,LAMPUUU AJAAAIIIIIBBB!!!,448662,16678,2023-04-02T14:21:46Z,PT18M23S,0
22,Erpan1140,MENCARI TAKJIL DIPENJURU DUNIA!,347989,11919,2023-03-31T11:16:22Z,PT21M35S,0
23,Erpan1140,"SAHUURR , SAHUUUUURRR!!",384409,16427,2023-03-28T19:39:05Z,PT17M10S,0
24,Erpan1140,Lagi LUCU LUCUNYA!!!,414397,15397,2023-03-25T12:42:41Z,PT21M28S,0
25,Erpan1140,JOKES  YG TIDAK GEY GEY  LAGI  !!,515867,19984,2023-03-19T01:51:37Z,PT19M33S,0
26,Erpan1140,INTRO ERPAN 2023!!,356119,17071,2023-03-18T10:39:07Z,PT18M13S,0
27,Erpan1140,SATU SATUNYA KAMERAMEN YG TIDAK SELAMAT!,498998,17620,2023-03-10T05:29:38Z,PT17M7S,0
28,Erpan1140,KELAKUAN RANDOM TIER BADAG EMANG FUNNY!,373287,13263,2023-03-07T07:50:53Z,PT15M56S,0
29,Erpan1140,ROMADHON TIBA ROMADHON TIBA!,352359,12419,2023-03-05T00:24:26Z,PT19M25S,0
30,Erpan1140,"JANUARI,MERKURIUS,NEPTUNUS,FEBRUARI,PLUTO , SIMONPETRUS,ANDREAS,HUTASOIT,NABABAN ,SIGABARIANG,SBG...",389625,13048,2023-03-03T10:55:27Z,PT19M57S,0
31,Erpan1140,SETAN MAIN LATO LATO!,362155,13660,2023-02-25T23:45:32Z,PT15M36S,0
32,Erpan1140,BESAR BULAT DAN KERAS?? APAKAH ITU ??,117278,3238,2023-02-24T12:20:53Z,PT24M37S,0
33,Erpan1140,"KELAKUAN RANDOM KUCING OREN , MONYET & BIJIKER!",370184,13240,2023-02-12T09:14:33Z,PT17M21S,0
34,Erpan1140,KAESANG LOW BUDGET 144P!,618075,19145,2023-02-11T14:37:10Z,PT23M35S,0
35,Erpan1140,BANG INTRO KAPAN BANG!!,292938,11862,2023-02-09T12:51:35Z,PT33M40S,0
36,Erpan1140,masbro masbro masbro masbro C A P Y B A R A !,553649,18758,2023-02-06T09:44:03Z,PT15M7S,0
37,Erpan1140,HAL YG GAMUNGKIN KALIAN PERCAYA KALAU GADIREKAM!,291149,10972,2023-02-03T09:53:10Z,PT13M19S,0
38,Erpan1140,SENJATA LEGENDARIS MAHLUK MARS!!,157593,5884,2023-01-31T07:04:42Z,PT18M5S,0
39,Erpan1140,APA ITU HARGADIRIII WANITAA!!!????,478359,16842,2023-01-27T14:38:52Z,PT16M41S,0
40,Erpan1140,"OUTPIT PERGI MANCING , NONGKRONG DAN NGECOR!!",375592,12880,2023-01-25T08:51:18Z,PT15M14S,0
41,Erpan1140,ORANNG MARS SUKA MAIN PEDANG PEDANGAN!,196310,8947,2023-01-21T14:32:09Z,PT20M50S,0
42,Erpan1140,GINI PERMAINAN TOP GLOBAL 1 CHOU LEE!,568068,26211,2023-01-18T14:44:00Z,PT17M34S,0
43,Erpan1140,AU AH GELAP PENGEN NAIK SPITBUD!,265264,10980,2023-01-16T11:30:34Z,PT16M32S,0
44,Erpan1140,STOP LATA LATTO LATTA LATTO!!,571916,18280,2023-01-11T12:33:07Z,PT17M55S,0
45,Erpan1140,KALAU INI SIH SUDAH MASUK JURANG!!,745797,30516,2023-01-09T13:26:14Z,PT25M21S,0
46,Erpan1140,KISAH CINTA PARA SUBRSCRIBER - CURHATDONK #2,200551,8707,2023-01-05T10:56:28Z,PT17M25S,0
47,Erpan1140,BANGUN BANG BELI MAGENUM 2 BATANG!!,459051,16316,2023-01-01T08:45:02Z,PT32M17S,0
48,Erpan1140,SEHARIAN GABUT BERSAMA MAHLUK MARS!!,242160,13828,2022-12-26T11:57:29Z,PT24M39S,0
49,Erpan1140,REKAMAN DI STUDIO BARU PALING ESTETIK!!,679277,26093,2022-12-24T11:08:22Z,PT27M44S,0
50,Erpan1140,SENDOK PLIS DOLAR IJO!,527576,17669,2022-12-18T10:41:12Z,PT15M36S,0
51,Erpan1140,KELUH KESAH HIDUP SUBSCRIBER - CURHATDONK #1,263659,12481,2022-12-16T13:37:38Z,PT20M7S,0
52,Erpan1140,SAINGAN LAGU ROJER SUMATRA!,431128,17417,2022-12-12T13:13:05Z,PT20M57S,0
53,Erpan1140,BEGINILAH HUMOR ERPAN!!,492350,18693,2022-12-10T11:05:28Z,PT17M2S,0
54,Erpan1140,ROOMTOUR STUDIO ERPAN TEMA 50S!,244670,14216,2022-12-07T12:47:25Z,PT34M9S,0
55,Erpan1140,INSTEGREM ADALAH TEMPAT YG MENGINSPIRASI!!,344565,15084,2022-12-05T11:23:44Z,PT13M9S,0
56,Erpan1140,HINDIii - BEDAH RUMAH!,391202,14619,2022-12-02T10:59:02Z,PT13M19S,0
57,Erpan1140,JEPANG MAENN BOLA PAKE KODAM EKOR 9!!,484568,19064,2022-11-30T08:23:43Z,PT20M30S,0
58,Erpan1140,MEMASAK SAMBIL BAKU  H4NTH4M!!,389241,14776,2022-11-24T12:09:28Z,PT18M34S,0
59,Erpan1140,SOUND EPEK TUT TET TUANG! TUANK TIUNK TREK KHUAK!,424656,15103,2022-11-23T11:15:06Z,PT14M26S,0
60,Erpan1140,ROJER SUMATRA!,388811,14618,2022-11-20T09:02:24Z,PT12M39S,0
61,Erpan1140,ALYA SI PALING PLAYGRILL!,607770,18610,2022-11-16T10:51:19Z,PT20M4S,0
62,Erpan1140,RUMAH TERJIBHANG DI ALAM SEMESTA!!,323047,12705,2022-11-12T11:19:28Z,PT22M30S,0
63,Erpan1140,KAMU NANYA???,365399,16619,2022-11-10T14:44:36Z,PT20M22S,0
64,Erpan1140,RIPIU ORANG MANDI!,466044,17120,2022-11-04T10:17:43Z,PT11M33S,0
65,Erpan1140,NGAPAIN SEDIH KALAU ERPAN UPLOAD TIAP HARI!,610997,21968,2022-10-27T14:10:32Z,PT19M9S,0
66,Erpan1140,SEKARANG BISA DAPAT UANG DARI DUNIA METAVERSE! PAKE TNGOO!!,170364,5569,2022-10-26T08:47:27Z,PT12M11S,0
67,Erpan1140,AYO KITA DUEL PEDANG!!,507178,19189,2022-10-25T09:27:56Z,PT17M22S,0
68,Erpan1140,GAME SERU BINGITSSS!! MARVEL SNAP INDONESIA!!,127053,4288,2022-10-22T13:16:43Z,PT17M37S,0
69,Erpan1140,"TIDAK UPLOAD 10 TAHUN , SEMOGA DIMAAFKAN!",503778,20161,2022-10-21T14:40:05Z,PT12M38S,0
70,Erpan1140,MENGSEMDIH DENGAN ACUMALAKA!,480411,19428,2022-10-18T10:40:26Z,PT14M4S,0
71,Erpan1140,YANG NONTON SAMBIL MAKAN LEMAH!,585271,24118,2022-10-13T11:26:43Z,PT17M9S,0
72,Erpan1140,APA HUKUMNYA AMBIL BUFF MUSUH?,711935,32182,2022-10-11T09:20:38Z,PT14M36S,0
73,Erpan1140,KOCHEANG PETARUNG!!!,540159,21575,2022-10-07T11:33:31Z,PT11M9S,0
74,Erpan1140,CARA MEMBUAT TRAUMA PENGGUNA MOTOR!!,710565,26811,2022-10-03T06:35:32Z,PT16M46S,0
75,Erpan1140,BUNDA RAHMA!!!,474204,21211,2022-10-01T12:10:44Z,PT12M5S,0
76,Erpan1140,DING DAENNG DUNG DI DENG DAEEEEENNNGG!!,685882,25332,2022-09-26T11:25:09Z,PT13M34S,0
77,Erpan1140,JANGAN SALAH SALAH MASUK PORTAL!!,258958,8933,2022-09-22T11:08:20Z,PT15M39S,0
78,Erpan1140,CARA MENJADI CANTIK/GANTENG NO ROOT - NGERAP,395532,16740,2022-09-19T08:05:41Z,PT11M53S,0
79,Erpan1140,CARA SATU SATUNYA DOLAR IJO!,523071,20967,2022-09-15T13:53:29Z,PT12M40S,0
80,Erpan1140,MALU SAMA OTOT BISEP!,690930,26209,2022-09-12T13:48:56Z,PT12M29S,0
81,Erpan1140,BERSMART BERSAMA SKUY!,497107,20488,2022-09-11T12:41:57Z,PT10M10S,0
82,Erpan1140,HAHHH! HAHHH!! HAHHH!!,651553,27540,2022-09-10T14:55:28Z,PT19M4S,0
83,Erpan1140,ENTE KADANG KADANG NGERAPP!!,489375,23159,2022-09-06T10:40:16Z,PT16M11S,0
84,Erpan1140,ENTE JAN NGADI NGADI ENTE!,552086,24468,2022-08-31T13:15:47Z,PT18M8S,0
85,Erpan1140,KIRIMAN DARI EDITOR MERAH! #2,688013,25843,2022-08-22T13:41:10Z,PT15M39S,0
86,Erpan1140,REAKSI MEME DARI EDITOR!,478097,21420,2022-08-21T14:37:59Z,PT13M40S,0
87,Erpan1140,MAIN GAME 17AN DIMARSS!!,205948,10997,2022-08-18T10:25:09Z,PT20M11S,0
88,Erpan1140,WOMEN MAHLUK TERSMART DIALAM SEMESTA!,452505,20806,2022-08-13T06:31:54Z,PT11M30S,0
89,Erpan1140,POKOKNYA KERJA !! KERJA !! KERJA!!,528479,25088,2022-08-10T11:29:05Z,PT17M4S,0
90,Erpan1140,YIIISSS BISA APLOD!,734240,30865,2022-08-08T15:40:58Z,PT14M53S,0
91,Erpan1140,ORANG ORANG PALING BERUNTUNG DI ALAM SEMESTA!,549169,26081,2022-07-28T11:40:11Z,PT12M14S,0
92,Erpan1140,CITAYEM PUNYA NI BOSS SENGGOL DONG!,687295,28473,2022-07-26T12:31:14Z,PT13M45S,0
93,Erpan1140,TUT TURUTUT  TUTUT TUTUT TUT TUT!,763009,32168,2022-07-22T12:47:39Z,PT16M26S,0
94,Erpan1140,PARA BHIJIE SUDAH PADA PUBER!,586906,25890,2022-07-20T12:50:30Z,PT19M56S,0
95,Erpan1140,INI BARU FRESH UNCH UNCH!,692362,31624,2022-07-15T11:50:44Z,PT12M11S,0
96,Erpan1140,CARA MELAWAN ISTRI TANPA BUFF NO ROOT!!,949113,37928,2022-07-11T09:50:23Z,PT11M35S,0
97,Erpan1140,JANGAN  LUPA NGEDATE  BARENG AYANG!,388059,19038,2022-07-10T10:49:58Z,PT11M50S,0
98,Erpan1140,TUTOR DAPET PACAR DARI TIKITOKO!,950723,37325,2022-07-09T09:11:03Z,PT21M26S,0
99,Erpan1140,MENCARI PENAMPAKAN TERSERAM!,598998,28142,2022-07-03T09:58:22Z,PT15M43S,0
100,Erpan1140,ERPAN SUDAH BERUBAH!,649877,35494,2022-07-02T11:29:21Z,PT21M10S,0
101,Erpan1140,ULTRAMEN GABOLE NANGID!,675835,30666,2022-06-30T09:47:46Z,PT12M28S,0
102,Erpan1140,BATTTLE ROYAL  YG PERANGNYA DI MARS!!,219646,9769,2022-06-26T12:17:05Z,PT12M34S,0
103,Erpan1140,GLIMOFGABISAMOVEON!,669561,30515,2022-06-24T12:09:12Z,PT15M16S,0
104,Erpan1140,INGIN MENCOBA SETELAN ANAK TIKTOK!,706972,29720,2022-06-22T12:20:30Z,PT15M13S,0
105,Erpan1140,BELAJAR BERBAHASA INDONESIA!,758353,31475,2022-06-15T14:44:09Z,PT13M5S,0
106,Erpan1140,a n n n j j h h i i m m m,677473,30847,2022-06-12T13:27:26Z,PT10M58S,0
107,Erpan1140,BABAYO OH BABAYO!!,753378,35068,2022-06-10T10:50:40Z,PT18M25S,0
108,Erpan1140,ERPAN SLEBEW NI BOS SIAP MENDINGINKAN BUMI!!ðŸ¥¶ðŸ¥¶ðŸ¥¶,698471,36346,2022-06-08T10:57:47Z,PT12M9S,0
109,Erpan1140,TUTORIAL PACARAN PERTAMA KALI!,764815,34039,2022-06-07T09:41:48Z,PT17M13S,0
110,Erpan1140,WINDOWS 2 ISLAMIC EDITION!,565533,27668,2022-06-03T10:28:38Z,PT15M5S,0
111,Erpan1140,TOP GLOBAL ML MAINNYA SAMA CIWI CIWILAH!!,277373,13749,2022-06-01T11:44:51Z,PT11M6S,0
112,Erpan1140,PARU PARU AWTO NGAKAK!,1182378,46946,2022-05-17T15:07:18Z,PT13M1S,0
113,Erpan1140,HEALING HEALING BAPAK KAU !!,989699,42336,2022-05-14T09:47:25Z,PT17M56S,0
114,Erpan1140,IKLAN GAME HP TERANEH - NGERAP #5,830725,40388,2022-05-10T09:15:27Z,PT12M40S,0
115,Erpan1140,KETIKA PUNYA TEMEN KEK PIRAWUN!,1252355,48457,2022-05-03T00:15:15Z,PT12M26S,0
116,Erpan1140,ðŸ¥¶ðŸ¥¶ðŸ¥¶ðŸ¥¶ðŸ¥¶ðŸ¥¶,917595,40773,2022-05-01T11:02:44Z,PT14M7S,0
117,Erpan1140,AYO MENCARI TAKJIL DI PRINDAPAN!,2209212,61501,2022-04-26T10:36:38Z,PT14M56S,0
118,Erpan1140,OBOROLAN ABSURD JAM 3 PAGI!,2148582,68392,2022-04-24T12:03:34Z,PT20M29S,0
119,Erpan1140,HIDUP DI DUNIA MIMPI!,882904,39015,2022-04-20T09:52:56Z,PT18M9S,0
120,Erpan1140,TUTOR NGOBROL SAMA ORANG INDIA!!,1063514,58785,2022-04-17T13:07:38Z,PT13M3S,0
121,Erpan1140,BERBUKALAH DENGAN YG ERPAN!,1628955,61392,2022-04-14T08:02:06Z,PT19M33S,0
122,Erpan1140,ASMR TERBAIK HANYA PUNYA PRINDAPAN!,721017,32679,2022-04-11T12:26:00Z,PT16M5S,0
123,Erpan1140,ILMU MENGGANDAKAN ISTRI! 100% WORK!!,732826,33938,2022-04-09T13:31:25Z,PT15M38S,0
124,Erpan1140,TAMPARAN MAUT WILL SMITH! BEGIILAH TANGGALAPN LESTI!,1123719,47998,2022-04-06T11:29:33Z,PT24M13S,0
125,Erpan1140,PLAYER ML ADALAH PEMAIN TERSOPAN DIDUNIA!,1099502,48922,2022-04-04T07:27:16Z,PT19M16S,0
126,Erpan1140,GAME YG PASTI PERNAH KALIAN MAININ DI RENTAL!!,211020,8133,2022-04-02T12:17:22Z,PT19M21S,0
127,Erpan1140,"GIMANA SUARA PLANET LUAR ANGKASA , MARS , BUMI , MATAHARI! - NGERAP #6",512890,24272,2022-03-27T10:48:41Z,PT23M30S,0
128,Erpan1140,LAY  LAY LAY LAY SUDAH GLOWUP!,823684,38800,2022-03-25T13:49:04Z,PT13M20S,0
129,Erpan1140,PERCINTAAN API GRATIS TERSEDIH ! NO 1 MENCENGANGKAN!!,840966,44012,2022-03-23T12:28:28Z,PT16M32S,0
130,Erpan1140,APAKAH  MANUSIA MASIH PUNYA KEBAIKAN ??,528258,28062,2022-03-22T08:55:10Z,PT16M24S,0
131,Erpan1140,APAKAH UFO NYATA ? KENDARAAN MAHLUK MARS!!,606559,29986,2022-03-20T11:07:39Z,PT18M12S,0
132,Erpan1140,im bek to pecebook part 2,602043,29541,2022-03-19T13:15:35Z,PT15M28S,0
133,Erpan1140,TORPEDO POPO!!,841151,41893,2022-03-17T11:09:56Z,PT14M30S,0
134,Erpan1140,ARAP SKIN KOLEKTOR!,1263919,55020,2022-03-14T13:31:42Z,PT12M37S,0
135,Erpan1140,TANTE TANTE ANAKNYA NONTON P3KOB!,359876,21792,2022-03-13T12:12:32Z,PT18M6S,0
136,Erpan1140,BYE BYE BALI!,162708,7594,2022-03-05T15:21:28Z,PT29M44S,0
137,Erpan1140,NASI TEMPONG TERENAK DI BALI !,229657,12409,2022-03-01T11:43:10Z,PT26M45S,0
138,Erpan1140,JALAN JALAN KE BALI YOK!,298526,17356,2022-02-25T13:15:05Z,PT20M43S,0
139,Erpan1140,MAIN TIKTOK KARNA DISURU AYANG,764159,34497,2022-02-24T12:46:52Z,PT12M38S,0
140,Erpan1140,KIYOMASAAA!!,889421,43277,2022-02-23T08:08:18Z,PT13M45S,0
141,Erpan1140,MASYARAKAT INDONESIA KETIKA TAU ...,934985,41686,2022-02-16T11:25:26Z,PT13M20S,0
142,Erpan1140,AM AN DI KE TU,524071,31450,2022-02-14T10:40:57Z,PT11M25S,0
143,Erpan1140,MARI KITA JALAN JALAN ONLEN!,537845,26552,2022-02-11T13:16:29Z,PT15M5S,0
144,Erpan1140,HARI PATAH HATI UNTUK SEMUA  LELAKI DIDUNIA!,718291,35216,2022-02-07T12:29:04Z,PT11M17S,0
145,Erpan1140,MENUNGGU DENGAN CEPAT!,978503,46625,2022-02-05T12:01:02Z,PT16M50S,0
146,Erpan1140,SEBERAPA HIGIENIS MAKANAN INDIA - NGERAP #4,1258646,48314,2022-02-03T13:06:54Z,PT19M8S,0
147,Erpan1140,AM ADIKETU,657464,39022,2022-01-31T13:01:46Z,PT15M55S,0
148,Erpan1140,PERANG DUNIA  BERSAMA IBU NEGARA!!,501146,26347,2022-01-28T12:18:04Z,PT16M15S,0
149,Erpan1140,gabut berujung penyesalan...,502802,25418,2022-01-27T12:06:27Z,PT18M37S,0
150,Erpan1140,NFT NFT BAPAK KAU!,1066961,47988,2022-01-25T11:39:13Z,PT18M10S,0
151,Erpan1140,HABISIN 6JT++ BUAH SKIN TERKAWAII MOBILE LEGEND!,643469,40000,2022-01-23T15:37:45Z,PT25M19S,0
152,Erpan1140,SHUAKSS!!,1365400,55708,2022-01-20T11:41:03Z,PT13M28S,0
153,Erpan1140,IKLAN TAILAND EMG TERDEBES! - NGERAP #3,627564,31034,2022-01-19T12:14:11Z,PT22M50S,0
154,Erpan1140,MASA MUDA ADALAH KEBOHONGAN!,1182920,48090,2022-01-16T13:43:56Z,PT18M53S,0
155,Erpan1140,RAUL!!!,785015,42459,2022-01-14T09:01:12Z,PT16M35S,0
156,Erpan1140,INTRO ERPAN TAHUN 2022!!,1171399,60140,2022-01-12T14:34:47Z,PT19M,0
157,Erpan1140,SETANN?? DILAWANLAH!!,1242543,58571,2022-01-08T12:21:47Z,PT23M37S,0
158,Erpan1140,incredibles cursed,1220163,54544,2022-01-07T12:09:36Z,PT18M32S,0
159,Erpan1140,MADAPAKE MEN!,883038,49983,2021-12-27T14:58:06Z,PT17M58S,0
160,Erpan1140,RATING IKLAN TERLUCU INDONESIA - NGERAP #2,900063,43637,2021-12-26T08:18:43Z,PT22M16S,0
161,Erpan1140,KONTEN DISCROT YG BERDEBU!!,868233,43866,2021-12-22T13:10:14Z,PT15M40S,0
162,Erpan1140,SPIDERMAN BUDI  BROKEN HOME!,1373490,56359,2021-12-20T10:28:11Z,PT21M3S,0
163,Erpan1140,SIMULASI MAHLUK MARS SEBELUM 2069! - Dynasty Origins: Conquest,155135,6884,2021-12-18T14:52:30Z,PT24M27S,0
164,Erpan1140,ANAK TIKI TOKO PASTI PALING COOLXZXZX!!,1014617,47000,2021-12-17T11:45:38Z,PT15M44S,0
165,Erpan1140,RATING ROOMTOUR YOUTUBER INDO! - NGERAP #1,1105895,56746,2021-12-15T12:20:18Z,PT29M20S,0
166,Erpan1140,MUKBANG SAMBIL NONTON INDIAN STREET FOOD DONG!,814520,39939,2021-12-12T11:47:11Z,PT17M10S,0
167,Erpan1140,KELAMAAN DIRUMAH SEMUA ORG JADI BOT!,1503233,60740,2021-12-11T15:15:57Z,PT23M37S,0
168,Erpan1140,SATISPAING GA LAPER IYA!!,654622,35930,2021-12-09T15:55:26Z,PT20M5S,0
169,Erpan1140,SELURUH DUNIA MENINGGOY TAPI KALIAN DAPET KUE!! - Would you press the button,510555,28255,2021-12-06T15:02:42Z,PT18M24S,0
170,Erpan1140,INGIN KU MATAHIN LEPTOP DAPAT 2JT!,1104699,51900,2021-12-04T12:18:47Z,PT21M42S,0
171,Erpan1140,CHAT PARA PEJUANG APLIKASI HIJAU!!,1290967,61596,2021-12-03T12:57:24Z,PT16M53S,0
172,Erpan1140,PUBGM BISA BERUBAH JADI SUPERHERO - PUBM X ARCANE,234584,14043,2021-12-02T10:02:12Z,PT15M57S,0
173,Erpan1140,epbre epbree...,1211727,60185,2021-11-28T14:35:55Z,PT14M38S,0
174,Erpan1140,KEPERNIKAHAN MEFELZ! SEKALIAN KE CANDI PRAMBANAN!,568323,35359,2021-11-24T08:51:43Z,PT32M14S,0
175,Erpan1140,PERTEMUAN WARGA TERKUTUK!!,767628,51739,2021-11-21T10:23:18Z,PT24M58S,0
176,Erpan1140,INI DIA SATISPAING VIP LIMITED EDITION!,1369174,52329,2021-11-18T14:07:22Z,PT15M49S,0
177,Erpan1140,MENGALAHKAN SELURUH SATIPAING YG ADA DI BUMI!,946981,47724,2021-11-14T15:29:35Z,PT18M46S,0
178,Erpan1140,ALASAN TYDAK BERMAIN GAME BERSAMA KAWAN!,523591,29409,2021-11-09T11:05:53Z,PT18M7S,0
179,Erpan1140,UU AA UU AA OPTIMUM PRIDE,2302021,115243,2021-11-08T10:50:17Z,PT14M20S,0
180,Erpan1140,BUKA TIKI TOKO MALAH KETEMU WAIFU!!,502725,29623,2021-11-07T13:40:57Z,PT16M59S,0
181,Erpan1140,chat chet chot mahluk bumi,1315040,68718,2021-11-04T15:02:28Z,PT17M30S,0
182,Erpan1140,SALAM DARI BINJAI!,915685,59312,2021-10-26T14:50:35Z,PT20M44S,0
183,Erpan1140,u i u a a ding ding wala wala ding ding,2179613,111404,2021-10-23T14:08:14Z,PT24M26S,0
184,Erpan1140,VIDEO INI DIBUAT 3 BULAN LALU!!,1175139,69150,2021-10-21T14:21:07Z,PT24M30S,0
185,Erpan1140,QNA BERSAMA ADIK KANDUNG ANTO DAN SUJINEM!,2169446,148060,2021-10-20T05:28:01Z,PT26M2S,0
186,Erpan1140,ROOM TOUR STUDIO MAHLUK MARS 2021!,724904,52878,2021-10-17T16:04:41Z,PT35M52S,0
187,Erpan1140,UTUP OH UTUP !!!,1104922,66154,2021-10-16T12:47:48Z,PT20M44S,0
188,Erpan1140,MAHLUK MARS DKK BERMAIN SQUID GAME!,1490345,121543,2021-10-07T12:28:00Z,PT25M56S,0
189,Erpan1140,ERPAN SEKARANG SUDAH BERUBAH?? - Q&A,929119,84438,2021-09-30T13:54:14Z,PT29M21S,0
190,Erpan1140,MAIN PUBGM SAMA MBA MBA GEMES CUMAN 15 RIBU!!,810879,43286,2021-08-10T12:21:11Z,PT35M36S,0
191,Erpan1140,CARA PEMBUATAN BENDA SEHARI HARI !!,1030798,49883,2021-08-08T15:33:57Z,PT23M22S,0
192,Erpan1140,IM BEK,1552060,79856,2021-08-02T15:14:34Z,PT14M13S,0
193,Erpan1140,MELIHAT KEINDAHAAN PAL PALE PAL PALEE!!,1631159,71945,2021-07-12T13:00:29Z,PT21M9S,0
194,Erpan1140,HARTA YG PALING BERHARGA ADALAH KELUARGA!!,1172982,55242,2021-07-11T10:50:03Z,PT18M23S,0
195,Erpan1140,GAME HP YG LAGI HYPE AKHIR AKHIR INI!!,471877,19357,2021-07-09T13:01:52Z,PT32M41S,0
196,Erpan1140,SEKARANG KITA MENJELAJAH REELS INSTAGREM!,1257513,60068,2021-07-06T15:29:29Z,PT19M46S,0
197,Erpan1140,MENJELAJAHI YOUTUBE SHORT!!,2423998,112155,2021-07-05T11:57:38Z,PT27M53S,0
198,Erpan1140,HANYA BAPAK BAPAK YG BISA MELAKUKANNYA!!,1552175,71298,2021-07-03T12:47:54Z,PT23M21S,0
199,Erpan1140,SIAPA YG TIDAK SUKA MENJADI BEBAN KELUARGA DAN KAYA RAYA!!,1295367,59779,2021-06-30T13:26:09Z,PT19M48S,0
200,Erpan1140,MELIHAT KEGABUTAN WARGA PRINDAPAN DI INTERNET!,1857192,77201,2021-06-29T14:22:49Z,PT21M15S,0
201,Erpan1140,ERPAN KEMBALI BERMAIN MENKREP,1760366,123577,2021-06-27T15:15:54Z,PT23M12S,0
202,Erpan1140,BENDA PALING KOTOR DI HP KALIAN!!,1277177,59922,2021-06-25T15:47:29Z,PT22M36S,0
203,Erpan1140,PENJUAL KOPI TERKECE YG ADA DI PRINDAPAN!,1646936,68791,2021-06-24T12:45:31Z,PT12M57S,0
204,Erpan1140,BAPAK KAU HANYA SEGELAS SUSU!!SAATNYA JADI DEDMIM,1768824,78871,2021-06-23T12:28:55Z,PT18M31S,0
205,Erpan1140,MELIHAT SENSASI MAKANAN ALA JEPUN!!,1060806,49918,2021-06-21T15:19:27Z,PT16M36S,0
206,Erpan1140,INDIA JUGA PUNYA MAKANAN YG HIGIENIS BOS!!,4088322,139268,2021-06-16T12:21:04Z,PT19M39S,0
207,Erpan1140,ALHAMDULILLAH BIJIKERS UDH PADA GEDE!!,1082373,60161,2021-06-15T13:48:32Z,PT21M38S,0
208,Erpan1140,MELIHAT MEME DISCORD YG BERDEBU!,964184,57286,2021-06-13T15:01:00Z,PT12M51S,0
209,Erpan1140,iya iya video yg ini kan yg klean mau!!,1136651,60581,2021-06-12T11:54:26Z,PT21M32S,0
210,Erpan1140,TOLONG JANGAN SENYAM SENYUM!!,931844,53000,2021-06-10T12:11:06Z,PT12M30S,0
211,Erpan1140,NONTON SAMBIL MAKAN DONG!!,576221,37006,2021-06-09T13:58:22Z,PT15M2S,0
212,Erpan1140,BERMACAM KEBOHONGAN DUNIA MAYA!!,1345990,71954,2021-06-05T05:58:36Z,PT11M14S,0
213,Erpan1140,SUDAH DITUNGGU BERIBUTAHUN LAMANYA,939281,64267,2021-06-03T13:34:53Z,PT13M57S,0
214,Erpan1140,DIRIKU KEMBALI!! PECINTA ANIME MASYUK!!,436444,19484,2021-06-01T12:21:30Z,PT23M48S,0
215,Erpan1140,INI VIDEO DIBUAT 2 MINGGU YG LALU!!!,938651,65092,2021-05-31T12:13:25Z,PT17M17S,0
216,Erpan1140,SUSAH PUNYA TEMEN OTAKNYA GESER!,1068054,53808,2021-05-11T11:00:54Z,PT19M8S,0
217,Erpan1140,INI DIA TERNYATA PENCIPTA BAHASA MEKSIKO!,1453972,75794,2021-05-06T10:14:49Z,PT21M26S,0
218,Erpan1140,STOP MAKSIAT START NONTON ERPAN!,1218412,61206,2021-04-30T19:09:10Z,PT21M52S,0
219,Erpan1140,MARKAS TERKUAT DARI MARS! MENGGUNAKAN METEOR!,705203,44174,2021-04-26T18:53:40Z,PT14M10S,0
220,Erpan1140,"MENCARI AIB?? , MENYELAM AELAH!",2193131,97311,2021-04-25T11:32:59Z,PT28M30S,0
221,Erpan1140,KELAKUAN WARGA MERAH PUTIH EMANG ASYIK!,2160594,95166,2021-04-23T11:31:22Z,PT22M55S,0
222,Erpan1140,"JANGAN LUPA FREESTYLE DULU DONG , PAPALE PAPALE !!",2416971,114784,2021-04-21T10:34:56Z,PT22M34S,0
223,Erpan1140,SAKIT YA OBATNYA NONTON ERPAN NONTON TIKI TOKO!,4053448,196799,2021-04-19T20:30:08Z,PT19M20S,0
224,Erpan1140,CARI TAQJIL ONLEN BERSAMA!!,911078,55742,2021-04-18T20:10:17Z,PT19M52S,0
225,Erpan1140,CHANEL PALING TYDAK CLIKBAIT DI UTUP!,1087523,60428,2021-04-16T20:52:33Z,PT25M38S,0
226,Erpan1140,UPIN DAN IPIN ADVENTURE !,2209949,105388,2021-04-15T10:30:01Z,PT21M13S,0
227,Erpan1140,PIJETAN TERENAK HANYA ADA DI PRINDAPAN!,1342689,66454,2021-04-13T13:18:28Z,PT19M3S,0
228,Erpan1140,HAL ANEH YG TERJADI WAKTU MAIN GAME!,769480,40724,2021-04-10T15:22:04Z,PT24M34S,0
229,Erpan1140,HANYA ERPAN YG TIDAK PUNYA MALU!!,1333041,67770,2021-04-09T12:45:21Z,PT23M56S,0
230,Erpan1140,HANYA PARA LEGEND YG PERNAH MAININ GAME INI!,641707,40554,2021-04-07T14:14:48Z,PT13M50S,0
231,Erpan1140,MAHLUK MARS AKHIRNYA KEMBALI JUGA!!,1140072,72928,2021-04-06T17:40:39Z,PT27M21S,0
232,Erpan1140,SANGAT SANGAT GELAPP!!,1502944,79917,2021-03-26T14:30:09Z,PT24M26S,0
233,Erpan1140,parkan 01,2083546,115029,2021-03-22T15:48:01Z,PT20M46S,0
234,Erpan1140,"BACAIN KOMENT SUBSCRIBER , ISINYA PADAN GEJOKE!",1035455,65287,2021-03-19T14:37:27Z,PT25M23S,0
235,Erpan1140,TRY NOT TO SAT W0oouUuWW,1428944,76888,2021-03-18T12:17:13Z,PT31M53S,0
236,Erpan1140,ERERERERERERERE DI TIKITOKO!!,1611384,98809,2021-03-16T13:40:45Z,PT28M6S,0
237,Erpan1140,MAKANYA YOUTUBE PREMIUM!!JAN PERTALITE,1770558,99549,2021-03-15T12:35:08Z,PT18M42S,0
238,Erpan1140,CARA MELATIH KESABARAN DENGAN INTERNET CEPAT!,1514442,82299,2021-03-13T09:36:44Z,PT24M27S,0
239,Erpan1140,TATTO INDIA BONUS HADIAH LEBARAN!,1584294,71475,2021-03-11T11:22:16Z,PT20M47S,0
240,Erpan1140,SUARA BIJIKERS SEPERTI ALUNAN CINTA,1225731,76118,2021-03-08T12:01:32Z,PT31M17S,0
241,Erpan1140,YG NONTON JAM SEGINI KALIAN SEMUA LUAR BIASA!!,1750457,100552,2021-03-05T17:29:48Z,PT20M59S,0
242,Erpan1140,AWTO TOXIC MASUK TIKI TOKO!!,1833543,92503,2021-03-04T14:22:09Z,PT27M42S,0
243,Erpan1140,BIARPUN AWTIS TAPI TETEP CINTE!!,962785,76626,2021-03-02T03:28:41Z,PT22M44S,0
244,Erpan1140,NONTON ERPAN TANPA HEADSET DONG!!,2295695,114528,2021-02-28T00:14:17Z,PT20M25S,0
245,Erpan1140,KENA RICKROLL 2X DI DISCORD!!!,1678215,89211,2021-02-26T16:37:16Z,PT22M17S,0
246,Erpan1140,ERPAN GREEN SCREEN DARI YUTUP LEBIH KREATIP!,2100415,130452,2021-02-25T13:57:16Z,PT25M6S,0
247,Erpan1140,NGAPAIN TIDUR KALAU BISA NONTON ERPAN!!,1661675,99727,2021-02-23T15:38:45Z,PT15M35S,0
248,Erpan1140,MAIN MENKREP MALAH BERGELUD!!,1127318,83025,2021-02-22T11:57:41Z,PT16M53S,0
249,Erpan1140,KELUH KISAH ANAK STM!! - PARAKACUK DEMO,734457,46423,2021-02-21T08:41:59Z,PT18M28S,0
250,Erpan1140,TIDUR BANGUN DAN NONTON SPONBOB!!,1478318,95053,2021-02-19T15:46:57Z,PT36M30S,0
251,Erpan1140,TUTOR GELUD SAMA MAHLUK BUMI!!,759739,52119,2021-02-18T11:34:45Z,PT13M43S,1
252,Erpan1140,GAME SIMPLE JELAS PADAT DAN NO 8BIT CLUB!,340341,19686,2021-02-14T22:45:16Z,PT15M31S,1
253,Erpan1140,IBU NEGARA REAKSIIN MAP ERPAN YG LEGEND!,2827297,138249,2021-02-14T14:20:34Z,PT33M12S,0
254,Erpan1140,PARA MEMBERSHIP SABAR OI!! ABIS NI RAJIN AKTIP DISCORD!,2485286,133328,2021-02-13T11:58:20Z,PT19M13S,0
255,Erpan1140,IYA IYA INI UPLOAD KOK!,1930195,113589,2021-02-11T08:00:11Z,PT20M42S,1
256,Erpan1140,INTRO ERPAN 2021 VERSI LITE!!,2582763,141672,2021-02-04T09:19:58Z,PT34M57S,0
257,Erpan1140,"MAIN KE GURUN , MARSNYA BUMI!!",1127516,74029,2021-02-02T11:17:34Z,PT36M5S,0
258,Erpan1140,!EDITAN YG MENGALAHKAN EDITAN MARVEL!,2854123,123136,2021-01-27T11:41:23Z,PT26M55S,0
259,Erpan1140,VLOG KE DUBAI BUAT NONTON PUBGM TURNAMENT!,1792947,142672,2021-01-25T16:53:45Z,PT27M32S,0
260,Erpan1140,TIKTOK JEPUN TOP GLOBAL,1359268,74062,2021-01-24T15:10:38Z,PT14M11S,0
261,Erpan1140,NONTON FINAL TURNAMEN PUBGM DUBAI!!,786976,49081,2021-01-24T12:55:49Z,PT1H43M55S,1
262,Erpan1140,NONTON FINAL TURNAMEN PUBGM DUBAI!!,0,2,2021-01-24T12:47:05Z,P0D,1
263,Erpan1140,CARA MEMBUAT LAPAR MAHLUK BUMI!!,2250404,106532,2021-01-23T15:27:45Z,PT24M12S,0
264,Erpan1140,MENCOBA MENENGOK HUMOR INSTAGRAM!!,1475961,87746,2021-01-22T11:18:48Z,PT23M6S,0
265,Erpan1140,KULI JAVVA PALING PRO DAN KREATIP!,1700684,97175,2021-01-20T04:15:23Z,PT15M24S,0
266,Erpan1140,"GAME HP KOK 8BIT , GENSHINLAH PRO EA!!",583953,36894,2021-01-17T14:42:15Z,PT20M52S,0
267,Erpan1140,MENCARI DOMBA DI MINECRAFT!,1655424,104914,2021-01-13T13:13:16Z,PT16M56S,0
268,Erpan1140,5 FACECAM KEK SEKOLAH ONLEN!,1093567,87235,2021-01-11T15:00:20Z,PT25M37S,0
269,Erpan1140,HARI MINGGU LIAT KETOMBELAH!!,2393699,133280,2021-01-09T23:04:13Z,PT15M28S,0
270,Erpan1140,ANIMASI PRIPAIR TERSYEDIH YG PERNAH ADA!,2866309,188358,2021-01-07T13:04:08Z,PT20M57S,0
271,Erpan1140,MARI BERCOCOK TANAM DI MENKREP!!,1309100,101573,2021-01-05T14:13:54Z,PT18M21S,0
272,Erpan1140,ingin diriku ke jepun lagi!!,1760250,92178,2020-12-31T04:56:06Z,PT26M34S,0
273,Erpan1140,"CAPE JADI UTUBER , PEN JADI SPANDUK AJA !!",2332208,111517,2020-12-29T13:57:34Z,PT18M38S,0
274,Erpan1140,EGA SURO AGA BIGI DIGA SUWROO!!,2419392,124395,2020-12-28T12:45:04Z,PT15M8S,0
275,Erpan1140,hueheueheuehueheuheee,1925320,113683,2020-12-25T13:19:50Z,PT20M38S,0
276,Erpan1140,TUTORIAL MENGUASAI BUMI 2077!!,580953,28758,2020-12-23T15:54:18Z,PT47M46S,0
277,Erpan1140,BUMI SETELAH TAHUN 2069 MELAWAN MARS!,1211423,55886,2020-12-22T13:48:11Z,PT48M50S,0
278,Erpan1140,EDITAN MAHLUK BUMI SUDAH KREATIF!!,1239441,76243,2020-12-21T14:45:51Z,PT21M8S,0
