,channel,title,view_count,like_count,upload_date,duration,was_live
1896,LetDa Hyper,ADA YANG MASIH INGET BUNDLE LEGEND INI x GYZEN BRUDAS â‰ï¸ PLAYER NEW MANATAU !! TAUNYA EMOTE ðŸ˜‚ðŸ˜‚,382296,17262,2022-04-11T09:19:00Z,PT12M5S,0
1897,LetDa Hyper,NIAT REVIEW CYBER GUARDIAN MALAH KETEMU FULL SQUAD DINO X ONE TAP KANGGURU BRUDASS â€¼ï¸ ðŸ˜±ðŸ˜±,191421,9047,2022-04-10T09:40:22Z,PT17M8S,0
1898,LetDa Hyper,AKHIRNYA BUNDLE BTS GUE LENGKAP â¤ï¸â¤ï¸ CUMA 9 DIAMOND NO CLICKBAIT BEGINI TRICKNYAâ€¼ï¸,99290,5815,2022-04-09T10:05:38Z,PT11M53S,0
1899,LetDa Hyper,FULL BTS LAGI ASIK KONSER DI AKHIR ZONA MALAH DI KHIANATIN BOCIL PRIK ðŸ˜¡ðŸ˜¡ BTS TOUR BERMUDA ðŸ˜‚ðŸ˜‚,82047,4084,2022-04-08T10:55:05Z,PT13M48S,0
1900,LetDa Hyper,BORONG INCUBATOR PARAFARAL ðŸ˜ðŸ˜ EH MALAH DAPET BTS CRYSTAL ðŸ˜±ðŸ˜± GARENA BUG ATAU GMN INI ðŸ¤«ðŸ¤«,176501,9904,2022-04-06T09:33:51Z,PT18M,0
1901,LetDa Hyper,NIAT BORONG ELITE PASS SCROLL OF AZURE MALAH HOKI DAPET BTS CRYSTAL CUMA 9 DM ! HOKI PARAAAAAH,268113,12099,2022-04-04T10:42:26Z,PT12M56S,0
1902,LetDa Hyper,LAGI REVIEW BUNDLE KARTUN DINO MALAH KETEMU FULL SQUAD EVOS IMMORTAL? KACAU JADI GAGAL REVIEW !!,167573,8250,2022-04-02T10:11:43Z,PT12M21S,0
1903,LetDa Hyper,Cobain Rasanya FT 15 TIM! Ada 60 Orang Auto Ngelag2 wkakakak,100586,5466,2022-03-31T04:59:15Z,PT19M47S,0
1904,LetDa Hyper,REVIEW AKUN MEMBER ETERNAL ! TERNYATA BANYAK PLAYER ESPORTNYA DAN ADA PREDATOR FFML,295702,17089,2022-03-28T08:06:57Z,PT22M41S,0
1905,LetDa Hyper,AWAL NYA DI KATAIN NOB SAMA TIM SENDIRI TAPI SETELAH LIAT INI MEREKA LANGSUNG TERDIAM !!! 27 KILL,83286,4679,2022-03-26T08:48:56Z,PT11M15S,0
1906,LetDa Hyper,INFO UPDATE TERBARU FREE FIRE SAMPAI MENJELANG LEBARAN ! EVENT DI PUASA GEGEH PARAAAH,76327,5034,2022-03-24T09:28:30Z,PT15M52S,0
1907,LetDa Hyper,Tebak Nama Nama S3nj4ta di free fire DAPAT 500RB !!! #shorts,2931005,141437,2022-03-22T09:25:35Z,PT1M,0
1908,LetDa Hyper,9 Menit Langusung Juara ? CS CUP Season12 KALI ini EZ WIN Banget! Gak Ada yang lebih keras lagi apa?,90596,5205,2022-03-20T08:39:18Z,PT9M52S,0
1909,LetDa Hyper,Gw Ditabrak Wraith waktu mau ngonten! sampe ditemenin tutorial bareng? Apex Legends Mobile Indonesia,187414,5572,2022-03-18T13:43:04Z,PT15M39S,0
1910,LetDa Hyper,PERTAMA KALI KE LOMBOK BOLEH NAIK MOTOR GP DI MANDALIKA ? TAPI MALAH DI KATAIN BOCIL EPEP PULANG AJA,115926,8836,2022-03-16T08:57:03Z,PT19M52S,0
1911,LetDa Hyper,DETIK DETIK EVOS JUARA ABU IKUT ANGKAT PIALA BIKIN MERINDING 1 PANGGUNG !!!,230841,12650,2022-03-14T04:52:20Z,PT6M31S,0
1912,LetDa Hyper,DETIK DETIK BION JADI PREDATOR ! MR05 CAPE JADI PREDATOR TERUSS !! KASIH BION AJA ...,57795,2494,2022-03-14T04:20:04Z,PT15M56S,0
1913,LetDa Hyper,KINGS EMOTIN EVOS ? GAK SALAH ? UDAH EMOTE2 EH RATA PULA CUMA 2 MENIT KWKWKW !!! JANJI GAK NANGIS?,40955,1859,2022-03-14T03:47:01Z,PT16M32S,0
1914,LetDa Hyper,ECHO TUSUN TERUS KENA TABRAK EVOS TERUSS !!! JANJI GA NANGIS DEK ? KWKWKW,46217,2247,2022-03-14T03:32:38Z,PT16M23S,0
1915,LetDa Hyper,LAGI LAGI FR NABRAK EVOS GAK SALAH ? EVOS BE LIKE MENDING TURU DEK !!,44448,2575,2022-03-14T03:22:31Z,PT16M31S,0
1916,LetDa Hyper,NCANG REGI GAMON ( GAGAL MONTAGE ) !!! SG CAS KU HAMPIR MERATAKAN TIM MU !!!,15649,1001,2022-03-14T03:15:07Z,PT17M15S,0
1917,LetDa Hyper,EVOS BALASKAN DENDAM TERHADAP ECHO? PUCUKMU AKAN KU MAKAN !!! SINGA ASLI YA EVOS BOSS !!!,48419,2611,2022-03-14T03:09:15Z,PT17M32S,0
1918,LetDa Hyper,SPIN INCUBATOR ANCIENT HUNTERS JEPANG â€¼ï¸ REVOLUSI BUNDLE ELITE PASS SEASON 1 â‰ï¸,112657,6363,2022-03-12T07:24:51Z,PT14M5S,0
1919,LetDa Hyper,ISYANA Main EPEP ? Kok Malah Jadi Gini ? Asep Kasih Pertanyaan Sesat EFDEWE Yg Kena Marah! ISYANA..,128558,8285,2022-03-11T06:57:40Z,PT20M21S,0
1920,LetDa Hyper,Ternyata Begini Rasanya FT Tapi Gak Pada ONMIC !! Auto NT Everyday Haha Pentingnya Komunikasi,95367,5340,2022-03-10T04:54:07Z,PT16M51S,0
1921,LetDa Hyper,FT YOTUBER IS BACK !!! 19 KILL Dengan Mode Terbang Menjadi Man Of The Match !!!,116925,6261,2022-03-07T09:42:22Z,PT13M10S,0
1922,LetDa Hyper,ASEP PETOT Keras Banget Sampe Nantangin 3 VS 1 !! Cak Paul & Absoh Langsung Panas !! HANTAAAAM ASEP,160425,8144,2022-03-05T05:30:11Z,PT22M31S,0
1923,LetDa Hyper,Bikin Kesel HamXD Ngetrol Di FT 100K Dia Di Kroyok 1 Squad Gw Looting Terus Sampe MABOK  GLOWAL KWKK,108089,6329,2022-03-04T02:22:42Z,PT16M53S,0
1924,LetDa Hyper,"Asep ngajakin biwon 3 member eternal sekaligus !? Lagi on fire katanya, absoh paul auto ngamuk",73298,5212,2022-03-03T06:00:12Z,PT16M13S,0
1925,LetDa Hyper,COBAIN FT BARENG PREMAN FT ! GILASIH AUTO KENA CARYYIN COY SKILNYA GAK NGOTAK,154414,7769,2022-02-27T08:17:36Z,PT22M15S,0
1926,LetDa Hyper,Borong Skin Famas 2JT? Cuma 6000 DM Udah LVL Max ? + Dapat 2 Emote Sekaligus?Begini Trik Rahasianya!,164265,10290,2022-02-26T06:40:21Z,PT15M35S,0
1927,LetDa Hyper,ID LETDA Naik Level 81 Selama 4Tahun Main FREE FIRE !! Yuk Intip Hadiahnya Apaa ? Menegangkan Banget,349514,19126,2022-02-24T10:28:25Z,PT12M57S,0
1928,LetDa Hyper,Cobain IDE G1LA Main CS Cup 2 AKUN SEKALIGUS ! Malah BERANTEM Gara2 Hal Ini !? Bikin Streeeeesss,164581,8641,2022-02-22T06:38:47Z,PT34M10S,0
1929,LetDa Hyper,Spin MISTERY SHOP eh Itemnya HILANG DI VAULT? Ini Kemana Kok Gak Masuk Vault !! Diskon Gede Tapi Kok,168880,9224,2022-02-21T06:34:26Z,PT18M10S,0
1930,LetDa Hyper,Kepintaran EVOS Masuk Lategame Walau Di Hadang RRQ ! Akhirnya Booyah Pertama Di DAY 2 FFML Match5&6!,101713,5125,2022-02-20T06:29:58Z,PT34M37S,0
1931,LetDa Hyper,Lagi Lagi Echo Dengan Konsisten Berhasil Memimpin Klasemen !! Yuk Lihat Strateginya Match3&4 FFML!,52905,2542,2022-02-20T06:19:46Z,PT34M26S,0
1932,LetDa Hyper,RRQ Kasiih Kembali Dengan Jumshot Legendarisnya Bisa Meratakan TPxOpi  ! 5 Detik ?? FFML Match1&2!,236692,12520,2022-02-20T04:08:03Z,PT33M10S,0
1933,LetDa Hyper,Kekuatan Baja EVOS Divine BISA NAHAN GEMPURAN DARI ONIC !! GRANAT BION Bikin ONIC Rata Cuma 3 Detik!,82116,3858,2022-02-19T04:00:13Z,PT17M51S,0
1934,LetDa Hyper,Akhirnya RRQ HIDE PANAS DI MATCH INI ! 5 Detik Musuh Rata !! DAN Evos Abax Ter Emote EVOS Auto Marah,108508,4276,2022-02-19T03:56:40Z,PT18M17S,0
1935,LetDa Hyper,Moment EVOS Ketemu RRQ HIDE DIKATULISTIWA ! EVOS Ngamuk LAWAN 3 TIM DI SATU TEMPAT !,89297,3897,2022-02-19T03:54:10Z,PT17M3S,0
1936,LetDa Hyper,GILAA Susahnya Perang DIBUKIT TAJAM KEMIRINGAN 90 DERAJAT Sejarah Perang VERTIKAL DI FFML,15863,760,2022-02-19T03:53:00Z,PT17M34S,0
1937,LetDa Hyper,Evos Di Bikin Tak Berdaya Di Kalahari Setelah Menerima Banyak Hujan Peluru Dari  Segala Arah !!!,29724,2363,2022-02-19T03:51:43Z,PT17M1S,0
1938,LetDa Hyper,FFML Match 1 ! Debut Pertama RRQ Hide Di Divisi 1 Dan Lagi Lagi Kerasnya Onic Di Counter Sama Echo!!,25580,1581,2022-02-19T03:48:16Z,PT17M11S,0
1939,LetDa Hyper,Ketika Kopral Jono & GyzenBNL Jadi RUSHER di FT ? Asep Support Auto Nikmat Ngelooting DiMedan Tempur,88601,4972,2022-02-18T06:11:02Z,PT17M32S,0
1940,LetDa Hyper,Pertama Kali Cobain CS CUP Malah EZ WIN ! Lebih Susah CS GRANDMASTER Drpd CS CUP ! Bener Gak ?!,365892,20329,2022-02-16T06:58:22Z,PT15M16S,0
1941,LetDa Hyper,Begini Rasanya Mode Malam Ditambah Hujan? Kaya Kehidupan Nyata ! Game 8bit Naik Pangkat Jadi 9bit,152440,7972,2022-02-12T09:53:14Z,PT11M39S,0
1942,LetDa Hyper,Keluh Kesah Konten TERIAKtor Emulator !! Apa Mesti PINDAH SERVER Cuma Karena Hal Ini?,129737,7666,2022-02-11T06:07:14Z,PT11M56S,0
1943,LetDa Hyper,1 Tahun Semenjak PENSI MAIN DI HP !  Pas Di Cobain Lagi KAKU PARAH !!!  KAYA BOT BARU MAEN HaHaHa,263434,12022,2022-02-08T09:19:51Z,PT15M21S,0
1944,LetDa Hyper,Dibilang Ngemis Sama Bocil Dari Server Singapore!  Langsung Hantam Sekeras Bac0tnya Smpe Kena Mental,356373,22547,2022-02-06T09:49:17Z,PT16M38S,0
1945,LetDa Hyper,Beli Akun Sultan Di Shopee Cuma 10Ribu Auto Beli 2 Eh Isinya Jos Banget !! Sampe Punya Skin Bayangan,2236584,59001,2022-02-04T06:14:03Z,PT9M42S,0
1946,LetDa Hyper,Kapok Niat Mau Borong Malah BONCOS 23JT ? Hancur Sudah Beli ELITE PASS 666 LAGI !!....,451183,23732,2022-02-02T09:55:04Z,PT16M39S,0
1947,LetDa Hyper,OH INI EFEK SAMPING SERVER EMULATOR DIPISAH SAMA SERVER HP!! JADINYA MUSUH BEGINI SEMUA ?,164877,9198,2022-01-29T08:22:35Z,PT19M24S,0
1948,LetDa Hyper,Test Mental Gue Ajakin Cit3rnya Mode Baygon Pake Seluruh Program illegal Dia !Anj**ng Ketar Ketir Gw,188539,9497,2022-01-28T06:23:34Z,PT13M31S,0
1949,LetDa Hyper,Makin Hari Makin Banyak Che4ternya ? Mode CS Rank Udah Gak Sehat Lagi & Banyak Oknum2 Perusak !!!,308407,14370,2022-01-26T08:25:24Z,PT16M36S,0
1950,LetDa Hyper,Pake Akun Istri Buka Timcode Malah Ketemu LetDa Dan Cekc0k Parah Antara Dua B0cil Saling Per4ng Wkwk,173720,9118,2022-01-24T10:58:13Z,PT12M57S,0
1951,LetDa Hyper,Pada KEMANA Pemain FREE FIRE? Kok Sering Dapet Beginian Ya Kalau Main Solo!! Tanda Mau Tamat Kah?,181391,11093,2022-01-22T09:59:50Z,PT10M50S,0
1952,LetDa Hyper,Cek Update Dan Review Jujur Di Patch Terbaru 2022 ! Semuanya Berubah Drastis ? Gimana Menurut Kalian,197518,11592,2022-01-20T10:25:47Z,PT20M18S,0
1953,LetDa Hyper,Pertama Kalinya LOGININ AKUN ISTRI Setelah 2 TAHUN PENSI Malah Dapet Banyak BONUS?!!!,469524,20487,2022-01-18T08:45:50Z,PT14M,0
1954,LetDa Hyper,Pertama Kali Main Solo Setelah 4Tahun Main Squad !! Baru Turun Kena Sandwich Parah Bikin Ketar Ketir,294185,15829,2022-01-16T08:37:54Z,PT13M7S,0
1955,LetDa Hyper,Akhirnya Epep Bisa Simpan Bundle Favorit + Login Dapat Banyak Diamond ? GARENA BERCANDA ???,240257,12900,2022-01-14T06:29:47Z,PT15M17S,0
1956,LetDa Hyper,Selamat Tinggal Badge 666 ! Gara2 Banyak Pikiran Jadi Ngawuuuur Hancuur Sudah Aaaaaarggghhh!!!,481298,23483,2022-01-13T03:40:06Z,PT13M26S,0
1957,LetDa Hyper,ROOM GM Banyak Citer ?! Mari Kita Buktikan Berburu GM Sama TOP REGION AlwiKobra !! Ketar Ketir Semua,297764,13937,2022-01-11T04:14:00Z,PT13M42S,0
1958,LetDa Hyper,Apakah Senjata SG HYPER Ini Bikin Gue Pensi Pake MP40?! REVIEW JUJUR Senjata PlanetMars Khusus LetDa,790206,34447,2022-01-09T05:44:36Z,PT20M24S,0
1959,LetDa Hyper,Ketemu Kembaran Gua ? DI GLOBAL ? Suara nya Malah Mirip GZ ?!! DAHLAH CEWE AUTO KETAR KETIR !!!,494462,21591,2022-01-08T04:17:06Z,PT11M13S,0
1960,LetDa Hyper,Sparing Parkour EVOS VS NANI !! Seberapa Pintar PRO Player EVOS ? IQ 1000 ++ !!!,238599,10891,2022-01-06T08:26:06Z,PT17M39S,0
1961,LetDa Hyper,Pertama Kali Login di Tahun 2022 Langsung Borong Semua Update !! Kupas Tuntas Sampe Ke Akar Shop !!,255976,14981,2022-01-04T07:56:58Z,PT14M34S,0
1962,LetDa Hyper,Pertama Kalinya LetDa Di Emotin CEWE !! Mental Gue Ketar Ketir Hmmmm Siapakah Dia ?!,241621,12673,2022-01-02T04:31:54Z,PT11M17S,0
1963,LetDa Hyper,Challenge Damage Terkecil Joget Pargoy?! Pertama Kalinya ABAAAX & KITKET JOGET PARGOY di LIVE wkaka,241491,12957,2022-01-01T01:26:08Z,PT16M,0
1964,LetDa Hyper,Duo BOCIL Adu MEKANIK Gara2 Timcode Disampahin Mulu !! Bocil JAWA Vs Bocil Sumatera? Mana Yang KERAS,273323,15406,2021-12-31T03:33:13Z,PT18M11S,0
1965,LetDa Hyper,KITKET Tremor Di Carryin Cewe Asal Jepang !! ASEP Turun Tangan Auto Berebut Cewe Baru Wakakak,223978,12354,2021-12-29T07:25:43Z,PT24M37S,0
1966,LetDa Hyper,Bocah Umur 13Tahun Udah Jago NgeCHE4T ?! Dari Mana Usulnya Yuk Kita Introgasi Dia ?? 1000 Teknik,363340,21399,2021-12-27T05:49:38Z,PT16M27S,0
1967,LetDa Hyper,Ketemu Cheater GOD MODE Pake Akun Palsu ??TERNYATA ID ASLINA SULTAN?Langsung SUSPEND DI TEMPAT!!,313862,19570,2021-12-26T08:55:11Z,PT10M2S,0
1968,LetDa Hyper,Kasih Challenge Ke ABAAAX Kill 15 BOOYAH Di LIVE Dapet 5000DM ?! Apakah Dia Mampu Kena Spion ??,1683096,52177,2021-12-24T07:03:23Z,PT17M13S,0
1969,LetDa Hyper,Oh Ternyata Karena Ini Bion Masuk Ke Evos ?! Kudu Di Nerf Sih Atau Gak Di Suspend Tangannya Wakakaka,260453,14224,2021-12-23T04:25:20Z,PT11M47S,0
1970,LetDa Hyper,P . ADU MEKANIK! Kombinasi Maut Bareng ASEP Sejak Hilangnya Krontod Bikin Semangat ASEP Barbar LOss!,262663,11213,2021-12-22T04:40:46Z,PT10M50S,0
1971,LetDa Hyper,Duo Apes LETDA X KITKET Bisa Membantai EVOS ABAX & STREET ???  INI DIA CARANYA !!,659292,19438,2021-12-21T04:54:13Z,PT24M12S,0
1972,LetDa Hyper,Solo Squad Nyamar Jadi FDW Auto Di Incer 1 Server wkkwkwkwk !! Seru Parah!! Musuhnya Gak Habis Habis,472554,20041,2021-12-18T06:32:08Z,PT15M55S,0
1973,LetDa Hyper,Jiwa Casino Gue Bergetar Ketika Punya Kartu AA di Tangan !! Gue Bungkus Semua Chip Di Meja !!,55141,3218,2021-12-17T10:06:56Z,PT13M50S,0
1974,LetDa Hyper,Nemenin EVOS Street Latihan Piala Presiden !? Skill Aslinya Keluar Gokill Rata 2 Tim Itungan Detik !,388607,15567,2021-12-16T07:17:12Z,PT11M30S,0
1975,LetDa Hyper,Mode Bhizer Dari STM EVOS VS STM Nani !! Bapak Jumshoot Sampe Turun Tangan Demi STM NANI !!,122282,7823,2021-12-15T04:30:07Z,PT23M15S,0
1976,LetDa Hyper,Nani Legend DiBantai Di Hari Pertama !? Sekarang Saatnya Rematch Pake Strategi LEGEND!!,353280,16678,2021-12-12T03:00:02Z,PT14M21S,0
1977,LetDa Hyper,Tes Kekuatan Roaster Baru EVOS ?? Apakah Makin Kuat atau LEMAH !? EVOS DIVINE VS NANI LEGEND Meong!!,1073432,37529,2021-12-10T11:22:01Z,PT26M33S,0
1978,LetDa Hyper,4Tahun Main EPEP Pake Nick LETDA!! Sekarang Telah Hilang Gara-Gara Dia!? Dahlah Balikin Nick Gue Woy,660120,35176,2021-12-05T10:37:02Z,PT18M34S,0
1979,LetDa Hyper,Solo VS Squad Pake Akun KITKET ? Niat Minusin KD Rank Malah Jumpa AL1en Ranked !! 4kun Suram Wakakak,318420,17163,2021-12-04T10:39:06Z,PT14M22S,0
1980,LetDa Hyper,Lagi Random Clash Kec1duk Yang Punya Akun !? Gue Dituduh Ch1ter Sama Kitket Gara2 Headshoot Mulu !!,727885,37122,2021-11-30T06:41:58Z,PT25M23S,0
1981,LetDa Hyper,"Bajak Akun EpEp Kitket Sampe Ke Livenya Gue Hancurin !! Hapus Pertemanan FDW, ASEP, JONO !!Mampus wk",389517,19726,2021-11-26T07:31:27Z,PT13M52S,0
1982,LetDa Hyper,Makan Pecel Lele Malah Ketemu Panutan EpEp ! #shorts,5138134,211760,2021-11-23T07:31:27Z,PT15S,0
1983,LetDa Hyper,Jadi Bocil Emote Malah Kena KARMA !! KAPOK Gua Jadi Bocil EMOTE ! Dahlah Masuk FYP wkakakaka,212486,12036,2021-11-22T04:47:15Z,PT10M9S,0
1984,LetDa Hyper,Kita Mengenang EpEp Old Burik TANPA KRONO Pake Grapik Smooth Auto Rabun Mata Gue! Mana iNSTO wkwkwk,319588,18776,2021-11-19T10:14:09Z,PT17M16S,0
1985,LetDa Hyper,Tim Kuning VS Merah Battle Real Life!? Kira-Kira Yang Dapet 250Juta Diamond Yaaaa? Ratakan Tim Merah,588001,39629,2021-11-17T05:35:58Z,PT11M53S,0
1986,LetDa Hyper,Persiapan Battle Clash Squad Di Real Life!! Begini Situasi Medan Perangnya Coy !! Mirip Craftland,851599,50279,2021-11-16T11:51:24Z,PT14M11S,0
1987,LetDa Hyper,Prank Global Malah Ketemu Anak Buah Paok Ngajak Duel ?! Ternyata Gue Kena Prank â˜¹ï¸ Naniiiii,427777,26791,2021-11-15T09:57:13Z,PT27M38S,0
1988,LetDa Hyper,Tebak Nama Nama Tempat di free fire #shorts,14852600,439004,2021-11-14T07:26:59Z,PT24S,0
1989,LetDa Hyper,"Nanii Gue Spin Evo Gun Skin Malah Rugi Dahlaaaah!! FDW, ASEP, DIMAS Auto Gue Ledekin UMP Kardus wkwk",494808,27353,2021-11-13T05:56:21Z,PT19M40S,0
1990,LetDa Hyper,Inilah Penyebabnya Gue Gak Mau Pake Scar Lagi!? Menghensut Sampe Disangka Che4ter sma Demon!! Dahlah,431563,30474,2021-11-09T07:55:43Z,PT10M15S,0
1991,LetDa Hyper,Nyamar Jadi BOCIL KATAK Ber ADIK !! Masuk TIMCODE BOSDEN wkkw ? Gua Lupa Matiin MIC? INI BENCANA !!!,373623,22291,2021-11-07T08:42:26Z,PT15M24S,0
1992,LetDa Hyper,Nyamar Jadi BOCIL GIFT !! Masuk TIMCODE Dimas FP wkakaka?? Bikin Dia Kesal Auto NGAMOK wkwkwkw!,821857,49911,2021-11-05T06:21:38Z,PT21M52S,0
1993,LetDa Hyper,Rambut Baru Spin AN94 Baru !! Efeknya Mirip Sama Warna Rambut Gue HaHaHa,437263,30633,2021-11-03T12:08:33Z,PT15M3S,0
1994,LetDa Hyper,Iseng Gacha 89 BOX Demi Koleksi STH Dan LEGENDARIS !! Yuk Liat Kira-Kira Apa Aja Ya Dapetnya ??,356770,23706,2021-11-01T02:18:20Z,PT16M32S,0
1995,LetDa Hyper,Ajakin GLOBAL Jadi Nakal !! Cosplay Jadi ANAK STM Bhizer Auto Baku Hantam kawokawoowa!!!,574136,30635,2021-10-30T09:30:27Z,PT22M39S,0
1996,LetDa Hyper,Nyamar Jadi Cewe Jepang Wibu!! Masuk TIMCODE BUDI 01 wkakaka?? Bikin Dia Kesal Auto NGAMOK wkwkwkw!,3172030,144577,2021-10-29T05:46:57Z,PT22M50S,0
1997,LetDa Hyper,Mengenang META DULU  Solo Squad di Zaman Now !? Ini Susahnya Solo Squad Di Meta Sekarang !!,230001,17917,2021-10-28T10:38:38Z,PT8M26S,0
1998,LetDa Hyper,Nyamar Jadi Pasangan JERMAN !! Masuk TIMCODE Yutuber ?? Pas Gua Pake Suara Asli Mereka Kaget !!! KWK,490000,27907,2021-10-27T10:12:44Z,PT13M57S,0
1999,LetDa Hyper,Keseruan Vlog Grand Final FFIM 2021 !! Evos Membuktikannya Ke-3 Kalinya !! Nguueeriiii,311835,27438,2021-10-25T04:52:29Z,PT15M42S,0
2000,LetDa Hyper,Nyamar Jadi DUO BUCIN!! Masuk Timcode Streamers !! Gue DIGODAIN Langsung Di AJAKIN 13 DETIK ?!! wkwk,553898,37939,2021-10-23T08:05:26Z,PT17M56S,0
2001,LetDa Hyper,Ketika KATAK Ber Adik 1 vs 1 Mode TUTUP Mata !!! AUTO Ngakak NJIR Pada nembak AWAN Sama Tanah KWKW,2225632,71907,2021-10-20T09:55:12Z,PT14M53S,0
2002,LetDa Hyper,Spin Cuma Habis 600DM !? Langsung BagiBagi Via Timcode Buat Viewers Biar Pada SPIN !!,350615,30297,2021-10-18T11:07:43Z,PT18M6S,0
2003,LetDa Hyper,Nyamar Jadi Bocil Konfik!! Masuk Timcode Kitket EH Malah Satu tim bareng cheater! AUTO NGAMOK2 DIA !,1453458,68266,2021-10-17T01:04:05Z,PT19M43S,0
2004,LetDa Hyper,Niat PRANK Malah Ketemu BOCIL SOPAN BANGET ! AUTO GUE ISIIN DIAMOND . TERHARU GUE COK,1621180,101252,2021-10-14T08:39:51Z,PT22M14S,0
2005,LetDa Hyper,"Niat Prank Pake Nick GZ , Malah Berujung Berantem Sama GLOBAL Di Katain Badut JAN SOK KERAS !!!",396550,30687,2021-10-13T08:46:20Z,PT11M31S,0
2006,LetDa Hyper,Ngeri Shotgun M1887 Legendary Emas !! Pelengkap SET LEGEND LetDa !! AUTO Bikin MAHAL AKUN LETDA !,729391,44968,2021-10-12T02:05:37Z,PT11M15S,0
2007,LetDa Hyper,Nyamar Jadi Bocil ISIAN Masuk TIMCODE Di GLOBAL!? Nemu Bucinan Terus KEPALA GUE Mau DiB4c0k Cowonya!,766694,48516,2021-10-11T08:22:44Z,PT11M29S,0
2008,LetDa Hyper,"Di Tantang Sama Editor Kalah Tukar Posisi !! Gua Kalah Jadi Editor , Dia Kalah Gak Di GAJI !!",791555,43374,2021-10-10T05:49:56Z,PT16M12S,0
2009,LetDa Hyper,Ketemu Para Panutan Gua Di PIALA PRESIDEN ESPORTS 2021 !!  #HYPERVLOG,515593,49309,2021-10-09T11:22:33Z,PT12M31S,0
2010,LetDa Hyper,Nyamar Jadi Adik Adik NGEMIS!! Masuk TIMCODE FDW wkakaka?? Auto NGAMOK FDW Karena Di Tagih Terus Wkw,1938342,105697,2021-10-06T09:12:42Z,PT12M45S,0
2011,LetDa Hyper,Nyamar Jadi Aki Aki C4bul!! Masuk Timcode GZ? Bikin GZ NGAMUK Sampe KESEL!! Auto Di Kick Wakakakaka,1262602,82574,2021-10-05T05:41:29Z,PT9M4S,0
2012,LetDa Hyper,Tes IQ GZ Dan FDW!! Pake Map Labirin Craftland Gua? Auto NGAMUK NGAMOK MEREKA wakakaakak,1240116,56318,2021-10-04T04:50:33Z,PT12M1S,0
2013,LetDa Hyper,"Duel bersama Heca Troll! Ini Orang GlLa Dah AWMnya Gak Ada Obat, Nengok Dikit Kena! Berasa Auto Aim",1330567,62650,2021-10-02T05:53:16Z,PT20M57S,0
2014,LetDa Hyper,NYAMAR JADI ADIK ADIK OFF MIC !!  MASUK TIMCODE FDW KWKW ?? AUTO NGETROL DI RANK KWKWKW,2136622,112203,2021-09-30T06:49:34Z,PT13M25S,0
2015,LetDa Hyper,Duel Bersama Cuk Gaming!! Habis Ngeprank Global Langsung Kita Ciduk Pake Nick BNL - Friendship WAR,349355,23505,2021-09-29T15:27:53Z,PT18M16S,0
2016,LetDa Hyper,Duel Bersama Amay Uwoe!! Auto Di Laporin Leader Guildnya - Friendship WAR,240308,18902,2021-09-29T02:59:17Z,PT14M46S,0
2017,LetDa Hyper,BARBAR DI GRANDMASTER SAMA TOP 1 DAN 2 REGION 40KILL,913764,51942,2021-09-28T01:05:59Z,PT13M8S,0
2018,LetDa Hyper,Duel Bersama Codex Gaming!! Asli Aimnya Terlalu Sadis Bikin Tangan Gue Insecure - Friendship WAR,403779,32105,2021-09-27T04:54:33Z,PT19M24S,0
2019,LetDa Hyper,Duel Bersama William GZ !! Glowallnya Cepet Banget Giila Gak Dapet Celah Nembak Gue - Friendship WAR,466132,33974,2021-09-26T06:13:13Z,PT23M20S,0
2020,LetDa Hyper,Unboxing GZ Sekalian Reunian Youtuber FreeFire Setelah 3thn Tidak Berjumpa !!! #HYPERVLOG,1849848,170806,2021-09-25T00:36:08Z,PT17M48S,0
2021,LetDa Hyper,Duel Bersama Top 1 GrandMaster Region Indonesia !! Kalah Minusin Rank !? GAS - Special 9Juta Subs,373507,25515,2021-09-24T06:12:28Z,PT20M45S,0
2022,LetDa Hyper,Duel Bersama Top 6 GrandMaster Region Indonesia !! Asli Mental Gue Kesenggol - Friendship WAR,427858,29866,2021-09-23T07:01:07Z,PT12M25S,0
2023,LetDa Hyper,Di Tantang By1 Sama TOP Region 100 GrandMaster ? Kalah Keluar Guild ? Oke Siapa Takut !!!,749874,36020,2021-09-22T07:50:56Z,PT14M8S,0
2024,LetDa Hyper,Gue Main Bareng Mereka Malah Rebutan Kill !! Keluarin Jurus Replek AIM Merah SMG #tiktokbonus,741826,38169,2021-09-21T06:13:57Z,PT14M33S,0
2025,LetDa Hyper,Oh Ternyata Begini Rasanya Jadi Player Kecil ?! Gue Niat Baik Malah Di HIN4 C4Ci M4Ki !! Gue Tusunin,457700,26821,2021-09-20T05:00:38Z,PT14M22S,0
2026,LetDa Hyper,Pertama Kali Dalam Hidup Gua Dapat Jackpot 9999 Diamond Dari Garena !!! MIMPI APA INI GARENAAAA!!!,599852,42875,2021-09-19T04:42:51Z,PT2M54S,0
2027,LetDa Hyper,Ranked Tersial ! Bertemu Rombongan GrandMaster Wamine Misha ! Lapangan HANGAR MENJADI RACING !,1461811,51891,2021-09-18T02:20:25Z,PT13M17S,0
2028,LetDa Hyper,"Keseruan SiBotak Teken Gaming Sama Sahabat Push Rank ! Ternyata Dia Pro Player, Nyesel Gue Lawan Dia",265607,15405,2021-09-17T04:46:29Z,PT16M5S,0
2029,LetDa Hyper,Duo Squad Maut di Grand Master Bareng Editor Auto Bikin Jantungan !!! Berburu Koin Malah DiBuru ?!,278539,19823,2021-09-16T05:00:42Z,PT11M28S,0
2030,LetDa Hyper,Oh Begini Rasanya Solo VS Squad Versi Halu ?! Apes Lagi2 Ketemu Cheater Baru !! Rooesaaaak dah,599577,25294,2021-09-14T10:30:33Z,PT12M18S,0
2031,LetDa Hyper,Oh Gini Ternyata Di Prank Kopral Jono !! Bikin Jantung Gue Deg2an Coy Pertandingan Persahabatan !!,1302483,56909,2021-09-13T13:37:32Z,PT17M14S,0
2032,LetDa Hyper,Oh Gini Rasanya Naek Mobil Sama Citer Bisa Nembus Tembok? GUE RELA MINUS 300 POINT DEMI KONTEN INI !,648863,35254,2021-09-12T02:26:00Z,PT13M1S,0
2033,LetDa Hyper,Sekarang Indonesia Punya FF Max !! Akhirnya LetDa Gak Harus Ke Singapore Lagi Untuk Main FF Max !!,1096114,42198,2021-09-11T03:19:06Z,PT13M8S,0
2034,LetDa Hyper,Ketemu Top Region Grandmaster Point 15.000+! Minta Aliansi KarnaTakut Minus ! Inilah akibatnya...,430596,26400,2021-09-10T06:14:01Z,PT13M22S,0
2035,LetDa Hyper,Prank Minusin Rank Grand Master Temen Kopral Jono Point 8200+ Sampe Minus Jadi 7150 !AUTO MARAH DIA!,1066285,54589,2021-09-09T05:34:31Z,PT14M25S,0
2036,LetDa Hyper,Oh Gini Rasanya Main Sama Grand Master Point 8000+ !? Isinya Wamine Wamine,926946,45277,2021-09-07T04:18:49Z,PT11M37S,0
2037,LetDa Hyper,GPX BERHASIL MENGALAHKAN META KORD DARI ONIC TAYOO DI LATEGAME,91894,4620,2021-09-06T02:00:25Z,PT16M22S,0
2038,LetDa Hyper,M79 DARI KINGS KZL MELUMPUHKAN 3 ORANG SEKALIGUS DI AKHIR ZONA !!,60423,3136,2021-09-06T02:00:06Z,PT18M19S,0
2039,LetDa Hyper,BARU LOOTING LANGSUNG PERANG DI PATAHAN AURA 5 TIM SEKALIGUS GILAK !! SETENGAH SERVER RUSUH DI FFML!,96664,5388,2021-09-06T01:45:00Z,PT18M8S,0
2040,LetDa Hyper,LAGI LAGI EVOS KETEMU THE PRIME ! MUSUH BUBUYUTAN DI FFML ADU MEKANIK DI AKHIR ZONA !,205062,12356,2021-09-06T01:30:04Z,PT18M53S,0
2041,LetDa Hyper,ZONA AKHIR MASIH 48 ORANG ! AUTO PECAH SEMUA TIM WAR DI REFENERY BIKIN GREGET  !!,84817,5815,2021-09-06T01:15:00Z,PT15M35S,0
2042,LetDa Hyper,3 PREDATOR FFML BERTEMU DI AKHIR ZONA !! LANGSUNG RICUH SAMPE ZONA HABIS !! EVOS VS ONIC VS IOG !,133439,8282,2021-09-06T01:00:07Z,PT18M7S,0
2043,LetDa Hyper,Nostalgia Free Fire Old Sebelum Ada Season Rank ! Player Baru Wajib Tau Ini,639128,60312,2021-09-03T10:00:56Z,PT12M32S,0
2044,LetDa Hyper,Detik-Detik Perebutan Grandmaster Ketemu Marga 4YOU !! Marga Baru Penerus TZY !?,664831,29792,2021-09-02T04:49:53Z,PT13M1S,0
2045,LetDa Hyper,ROAD TO GRAND MASTER 4 JAM X2 CARD !!! SEASON 23 FREE FIRE - LETDA HYPER,541274,37623,2021-09-01T04:44:13Z,PT11M1S,0
2046,LetDa Hyper,Gak Punya Skin Wajib Tonton Ini Biar Semangat Berlatih !! Pake Akun Istri No Skin No Problem !!,324083,16476,2021-08-29T04:49:15Z,PT11M14S,0
2047,LetDa Hyper,Prank Global Pake Akun Kecil Malah Berujung Diajakin Biwon?! Tiba2 Ada Kecoa Terbang Anj T0xic ****,1099708,54367,2021-08-28T01:57:19Z,PT15M36S,0
2048,LetDa Hyper,Menurut Kalian APES atau HOKI!? Beli Akun Harga Murah Tapi Isinya Bukan Murahan!!,2018757,78422,2021-08-27T02:01:30Z,PT12M56S,0
2049,LetDa Hyper,"AKUN SI ASEP PINDAH KE SERVER VIETNAM? GLOWALNYA 42 & KATANA NYA 15 LENGKAP PARAH,GUA JADI IRI NJIR!",1084804,45903,2021-08-26T02:17:17Z,PT21M3S,0
2050,LetDa Hyper,Para ESPORT Rebutan Mau Rekrut LETDA Main FFML ?? Karena Keahlian Hengker Teleportku ?!!,167985,10111,2021-08-25T07:42:16Z,PT17M20S,0
2051,LetDa Hyper,Akhirnya LetDa Kembali Main Di FFML Season 4!! Dengan Roster Baru Auto TAUNTING!,476589,30383,2021-08-24T04:18:40Z,PT19M9S,0
2052,LetDa Hyper,Begini Rasanya TIMCODE Tapi Main FASTUR ?! Auto Menggila !! BUKANMAEN Abah Di Carry Mereka !,505101,18370,2021-08-23T07:11:49Z,PT18M56S,0
2053,LetDa Hyper,3X BERTURUT TURUT EVOS KETEMU ONIC LAGI ?? KALI INI EVOS MEMBUKTIKAN ! LANGSUNG SIKAT ONIC !!,460687,24242,2021-08-22T08:19:34Z,PT18M13S,0
2054,LetDa Hyper,MATCH 2 LAGI LAGI EVOS BERTEMU ONIC MAKIN PANAS !!! SALING NGAMOK !,149711,7980,2021-08-22T08:12:20Z,PT16M8S,0
2055,LetDa Hyper,MATCH 1 FFML ZONA AKHIR MENYERAMKAN POT NERAKA !! MASIH SISA 3 TEAM ??,255419,13971,2021-08-22T08:05:22Z,PT19M22S,0
2056,LetDa Hyper,Abah Hyper Pake Mode Ultimate Langsung Dapat Pet Ter Op !!!,76234,5562,2021-08-20T06:42:00Z,PT10M20S,0
2057,LetDa Hyper,Bocil Songong Ngajakin By One Pake PC ? Bukanmaen bah ! Auto Kena Mental PC VS PC !!,851972,42636,2021-08-18T05:07:32Z,PT20M5S,0
2058,LetDa Hyper,1 Lawan 1 ? LetDa Vs Cheater VIP Semua Mode Dipake !!  Biwon Match Keras ...,364291,22395,2021-08-15T06:23:15Z,PT8M16S,0
2059,LetDa Hyper,Awalnya Kukira Cheater nya NOB ? Ternyata ... Dia PRO HENGKER TELEPORT HANDAL ! 1 DETIK RATA !!!,1179681,47427,2021-08-14T04:12:01Z,PT10M5S,0
2060,LetDa Hyper,"Ketemu Cheater Auto Headsoot, Isi Medkit Sambil Lari Gils, Teleport Juga ?! Ini BENCANA !",830575,35948,2021-08-13T06:56:32Z,PT33M26S,0
2061,LetDa Hyper,"LetDa, Deandra, Mora, Diki VS Kopral Jono , FDW , Dims, Asep !!! 4 vs 4 Clash Squad Lawak !!!",564439,23142,2021-08-11T03:31:12Z,PT15M33S,0
2062,LetDa Hyper,AURA VS EVOS Clash Squad Pre Heat Series ! MENEGANGKAN PRONE SHOOT Dari VADER Bikin EVOS Terkecoh !!,592868,31810,2021-08-09T04:24:17Z,PT19M47S,0
