,channel,title,view_count,like_count,upload_date,duration,was_live
3650,Windah Basudara,ADA YANG MENGINTAI KITA DI PEMBERHENTIAN BUS TERAKHIR! Last Bus Home,1090979,53861,2022-06-29T08:56:59Z,PT18M7S,1
3651,Windah Basudara,SESULIT APA MENJADI SUPIR BUS! Bus Simulator Indonesia GAMEPLAY #1,2055137,93575,2022-06-29T07:13:47Z,PT1H5M51S,1
3652,Windah Basudara,STUMBLE GUYS MACAM APA LAGI INI! Fall Dudes,881949,42658,2022-06-29T04:07:28Z,PT34M33S,1
3653,Windah Basudara,SAATNYA ULTRAMAN BERSATU! Ultraman Fighting Evolution Rebirth GAMEPLAY #1,1631089,60693,2022-06-28T08:14:07Z,PT1H59M41S,1
3654,Windah Basudara,GAME MIRIP STUMBLE GUYS INI AKHIRNYA GRATIS! Fall Guys,1291420,57555,2022-06-27T08:36:19Z,PT30M8S,0
3655,Windah Basudara,AKU HARUS JADI ORANG PERTAMA DI INDONESIA YANG PUNYA GEROBAK BERKILAU! Bakso Simulator GAMEPLAY #6,1006659,51239,2022-06-27T07:57:59Z,PT41M50S,1
3656,Windah Basudara,AKHIRNYA AKU BERHASIL MENGALAHKAN WARDEN DENGAN PASUKAN GOLEM! Minecraft,914004,50387,2022-06-26T15:56:29Z,PT37M14S,1
3657,Windah Basudara,AKU MENYELAMATKAN SEMUA KARAKTER RAHASIA! Raft Final Chapter TAMAT,1094237,42247,2022-06-26T13:10:44Z,PT1H36M52S,1
3658,Windah Basudara,SIAPA YANG PANTAS MASUK SURGA DAN SIAPA YANG MASUK NERAKA? Malaikat Tuhan,1373329,55889,2022-06-26T09:25:52Z,PT40M29S,1
3659,Windah Basudara,AKHIRNYA UPDATE BESAR YANG SEBENARNYA DI STEAM! Bakso Simulator GAMEPLAY #5,1439443,53460,2022-06-26T07:41:56Z,PT1H46M20S,1
3660,Windah Basudara,"BATMAN vs SUPERMAN, INILAH GOOD ENDING SESUNGGUHNYA! Injustice 2 TAMAT",353607,19354,2022-06-25T10:59:01Z,PT20M49S,0
3661,Windah Basudara,TANTANGAN DAPETIN 4 SKIN SPECIAL SEKALIGUS! Stumble Guys,1749900,79230,2022-06-25T05:50:36Z,PT29M29S,0
3662,Windah Basudara,KURA KURA NINJA BERSATU BERSAMA JAYA ESPORT! Teenage Mutant Ninja Turtles: Shredder's Revenge,772178,31716,2022-06-24T16:50:27Z,PT2H26M22S,1
3663,Windah Basudara,PERJALANAN KAPAL KAYU BERAKHIR BAHAGIA! Raft Final Chapter GAMEPLAY #4,1723829,60008,2022-06-24T10:59:16Z,PT1H56M31S,1
3664,Windah Basudara,HOROR TENTANG DINOSAURUS YANG LEPAS DARI KANDANG! T-Rex Breakout,867561,42413,2022-06-22T16:21:58Z,PT15M43S,1
3665,Windah Basudara,APAKAH MANUSIA TOILET KEMBALI LAGI? Poop Killer 2,1105994,47269,2022-06-22T14:06:20Z,PT33M23S,1
3666,Windah Basudara,BERSAMA MENYELAMATKAN ORANG MISTERIUS DI PULAU ES! Raft Final Chapter GAMEPLAY #3,1502063,49810,2022-06-22T10:59:42Z,PT1H50M19S,1
3667,Windah Basudara,KATANYA ADA AKU DAN MIAWAUG DI GAME BUATAN INDONESIA INI! Ngopi Yuk!,1159442,55328,2022-06-22T07:05:53Z,PT1H19M2S,1
3668,Windah Basudara,BERSAMA KE PULAU BARU DAN KALAHKAN BADAKLODON! Raft Final Chapter GAMEPLAY #2,2601827,83334,2022-06-21T19:23:16Z,PT2H16M3S,1
3669,Windah Basudara,PERSIAPAN PETUALANGAN TERAKHIR DI KAPAL KAYU! Raft Final Chapter GAMEPLAY #1,967593,46751,2022-06-21T10:23:31Z,PT33M2S,1
3670,Windah Basudara,ADA YANG ANEH DI BANK INI! I'm on Observation Duty 5 TAMAT,1358277,59532,2022-06-20T15:12:39Z,PT56M19S,1
3671,Windah Basudara,SAATNYA BUKA PET RAHASIA DAN KALAHKAN BOSS TERAKHIR! insaniquarium Deluxe TAMAT,635425,24492,2022-06-20T09:57:09Z,PT1H18M14S,1
3672,Windah Basudara,MEREKA DULU PASANGAN YANG ROMANTIS! TAPI SEKARANG KOK.... Whack Your Ex,1392192,58959,2022-06-20T07:00:43Z,PT20M55S,1
3673,Windah Basudara,UPDATE BARU BESAR BESARAN BISA MASUK ARCADE! Bakso Simulator GAMEPLAY #4,1385325,55286,2022-06-19T07:36:48Z,PT39M35S,1
3674,Windah Basudara,SAATNYA KITA TAMATKAN GAME BURUNG! Angry Birds 2 TAMAT,882329,36241,2022-06-19T05:34:15Z,PT1H29M14S,1
3675,Windah Basudara,AKHIRNYA SEMUA REMAJA SELAMAT! The Quarry TAMAT,983243,43441,2022-06-18T16:33:17Z,PT1H35M43S,1
3676,Windah Basudara,SAAT SUPERMAN DAN BATMAN MENJADI JAHAT! Injustice 2 GAMEPLAY #3,644720,27214,2022-06-18T02:52:00Z,PT1H14M36S,1
3677,Windah Basudara,APAKAH SUPERMAN MENJADI JAHAT? Injustice 2 GAMEPLAY #2,766807,31272,2022-06-17T11:19:45Z,PT1H37M19S,1
3678,Windah Basudara,APAKAH IKAN BIRU RAJA ITU NYATA? insaniquarium Deluxe GAMEPLAY #4,514078,20104,2022-06-16T15:54:44Z,PT45M15S,1
3679,Windah Basudara,SAATNYA BALAS DENDAM TERHADAP WARDEN DENGAN PASUKAN GOLEM! Minecraft,1284156,60071,2022-06-16T14:06:28Z,PT43M1S,1
3680,Windah Basudara,SEKARANG ADIKNYA LUNA NELPON AKU! Salah Sambung 2 GAMEPLAY #1,828768,33804,2022-06-16T11:08:13Z,PT1H7M6S,1
3681,Windah Basudara,ADA PENGUSAHA KAYA DATANG KE WARUNG BAKSO KITA! Bakso Simulator GAMEPLAY #3,1110438,43626,2022-06-16T09:14:43Z,PT38M6S,1
3682,Windah Basudara,BAGIAN PALING BRUTAL ANAK KECIL DILARANG NONTON! The Quarry GAMEPLAY #4,1305289,49757,2022-06-15T15:49:28Z,PT2H23M47S,1
3683,Windah Basudara,INILAH PERANG PARA SUPERHERO PERKASA! Injustice 2 GAMEPLAY #1,986372,40510,2022-06-15T07:16:37Z,PT1H43M47S,1
3684,Windah Basudara,SAATNYA UPGRADE KANG BAKSO DAN PECAHKAN MISTERI! Bakso Simulator GAMEPLAY #2,1666738,60364,2022-06-14T10:19:27Z,PT1H15M18S,1
3685,Windah Basudara,RUPANYA INI WUJUD MANUSIA SERIGALA YANG KITA HADAPI! The Quarry GAMEPLAY #3,1019841,39202,2022-06-13T22:49:35Z,PT1H57M43S,1
3686,Windah Basudara,RYAN BERLARI DAN MELOMPATI BATU! The Quarry GAMEPLAY #2,341341,16278,2022-06-13T17:02:27Z,PT5M8S,1
3687,Windah Basudara,APAKAH WARDEN ITU ADA DAN NYATA? Minecraft,1466981,71218,2022-06-13T14:46:17Z,PT1H8M17S,1
3688,Windah Basudara,AKHIRNYA KANG BAKSO FULL RELEASE! Bakso Simulator GAMEPLAY #1,1350122,56115,2022-06-13T10:13:42Z,PT43M7S,1
3689,Windah Basudara,AKU INGIN PINTAR DENGAN TANTANGAN KUIS INI! Quiz Mobile ParampaaX,598054,31517,2022-06-13T07:02:34Z,PT30M1S,1
3690,Windah Basudara,AKU COBA HUBUNGI LUNA LAGI! Salah Sambung TAMAT,1838870,80166,2022-06-12T04:38:35Z,PT1H26M20S,1
3691,Windah Basudara,Live IRL Pertama Kalinya! Gacha Mainan Wibu di Dunia Nyata!,1434257,82144,2022-06-11T14:27:14Z,PT45M17S,1
3692,Windah Basudara,WHAT BENERAN ADA TATSUMAKI KALI INI! Arena of Valor,866294,39483,2022-06-11T11:10:51Z,PT1H2M49S,1
3693,Windah Basudara,ADA YANG ANEH DI RUMAH TUA INI! I'm on Observation Duty 5 GAMEPLAY #5,1295556,45690,2022-06-11T07:23:38Z,PT1H4M29S,1
3694,Windah Basudara,REMAJA REMAJA INI TAK TAU APA YANG MEREKA HADAPI! The Quarry GAMEPLAY #1,1704778,61808,2022-06-10T20:27:54Z,PT3H6M44S,1
3695,Windah Basudara,MISTERI MENGERIKAN TIMMY AKHIRNYA TERPECAHKAN! The Backrooms 1998 TAMAT,1337024,60338,2022-06-10T11:01:19Z,PT1H4M23S,1
3696,Windah Basudara,KATANYA INI GAME BACKROOM PALING SERAM! The Backrooms 1998 GAMEPLAY #1,1892601,79503,2022-06-09T15:39:15Z,PT34M51S,1
3697,Windah Basudara,ADA YANG ANEH DI APARTEMEN INI! I'm on Observation Duty 5 GAMEPLAY #4,1679141,56939,2022-06-09T12:36:51Z,PT45M11S,1
3698,Windah Basudara,AKUARIUM IKAN SEMAKIN BARBAR! insaniquarium Deluxe GAMEPLAY #3,615788,24914,2022-06-09T08:18:39Z,PT1H6M44S,1
3699,Windah Basudara,BOSSMU ADALAH ORANG YANG RESEH! TAPI KOK.... Whack Your Boss,1640605,61361,2022-06-09T06:56:27Z,PT27M12S,1
3700,Windah Basudara,MISTERI MENGERIKAN YANG CUMA ADA DI VERSI JADUL 666! Bakso Simulator,2248968,74978,2022-06-08T10:02:13Z,PT58M48S,1
3701,Windah Basudara,ADA YANG ANEH DI KAMPUNG HALAMAN! Jurnal Malam : Pulang Kampung,2501173,92802,2022-06-07T14:00:47Z,PT37M19S,1
3702,Windah Basudara,SAATNYA KITA BELI RESEP BARU DAN MELATIH KANG BAKSO! Bakso Simulator,1278561,52036,2022-06-07T10:52:56Z,PT51M54S,1
3703,Windah Basudara,KITA KE INAZUMA DAN SEMOGA DAPAT YELAN SANG WAIFU BARU! Genshin Impact,986045,40834,2022-06-06T16:07:55Z,PT1H33M10S,1
3704,Windah Basudara,SAATNYA MENDAPATKAN SKIN SPECIAL TERAKHIR NAGA MERAH! Stumble Guys,5116149,164269,2022-06-06T10:15:37Z,PT50M2S,1
3705,Windah Basudara,BAYI KUNING KEMBALI DAN INGIN DI DONGENG! The Baby In Yellow: Bedtime Stories,1989059,73653,2022-06-05T14:29:11Z,PT1H15M40S,1
3706,Windah Basudara,AKHIRNYA KANG BAKSO YANG DIUSIR KEMBALI! Bakso Simulator,1773947,65813,2022-06-05T11:09:49Z,PT1H13M3S,1
3707,Windah Basudara,AKHIRNYA AKU MAIN UPDATE BOLA 2022 YANG REAL! eFootball 2022,1955625,67966,2022-06-05T09:38:53Z,PT2H48M13S,1
3708,Windah Basudara,WANITA INI SALAH MENELPON! Salah Sambung GAMEPLAY #1,980646,46707,2022-06-05T04:18:48Z,PT45M46S,1
3709,Windah Basudara,KATANYA GAME INI PEMANDANGANNYA SANGAT INDAH! Sky: Children of the Light,1444470,48117,2022-06-04T13:56:15Z,PT1H44M37S,1
3710,Windah Basudara,MISTERI MANUSIA TOILET YANG MENGERIKAN! Poop Killer,1191423,49258,2022-06-03T15:55:04Z,PT37M37S,1
3711,Windah Basudara,AKU LOLOS DARI KEPUNGAN ZOMBIE DAN MANUSIA JAHAT! ZOZ: Final Hour,538286,19107,2022-06-03T14:06:14Z,PT31M4S,0
3712,Windah Basudara,SUSTER IBLIS KEMBALI MENGEJAR! Evil Nun Rush GAMEPLAY #1,788510,37745,2022-06-03T11:22:45Z,PT1H10M57S,1
3713,Windah Basudara,KITA COBA MOBA YANG SATU INI DENGAN EVENT TERBARUNYA! League of Legends: Wild Rift,672179,31423,2022-06-03T08:39:13Z,PT1H34M11S,1
3714,Windah Basudara,AKHIRNYA YANG KITA TUNGGU UPDATE TERBARU 2022! eFootball 2022,718050,34025,2022-06-03T05:53:17Z,PT24M7S,1
3715,Windah Basudara,MISTERI PENAMPAKAN ASLI SARAH TERUNGKAP! Warnet Simulator GAMEPLAY #21,1296163,57735,2022-06-01T13:55:34Z,PT48M30S,1
3716,Windah Basudara,IKAN APALAGI YANG AKAN KITA DAPATKAN? insaniquarium Deluxe GAMEPLAY #2,696055,26733,2022-06-01T10:44:20Z,PT1H13M51S,1
3717,Windah Basudara,Mencoba Gacha Mainan Among Us Semoga Dapat Yang Langka!,774298,38934,2022-06-01T07:55:35Z,PT33M11S,1
3718,Windah Basudara,GORILLA INI BISA TERBANG! Flying Gorilla,581067,29462,2022-06-01T03:17:22Z,PT53M40S,1
3719,Windah Basudara,SAATNYA MEMBELI MONSTER TERMAHAL DAN ROBOT! My Singing Monster GAMEPLAY #5,1158952,41057,2022-06-01T01:31:27Z,PT48M20S,1
3720,Windah Basudara,APAKAH PENANTIAN PANJANG AKAN BERAKHIR DISINI? Mobile Legends,1394211,73439,2022-05-31T09:48:16Z,PT50M43S,1
3721,Windah Basudara,PAMERAN BADUT YANG MENGERIKAN! YANG TAKUT BADUT JANGAN NONTON! Exhibit of Sorrows,972213,43523,2022-05-24T15:55:30Z,PT26M50S,1
3722,Windah Basudara,DAPAT BINTANG 5 BARU DAN VENOM! Marvel Contest of Champions GAMEPLAY #3,766975,28861,2022-05-24T14:22:55Z,PT56M59S,1
3723,Windah Basudara,AKU HARUS MENJAGA AKUARIUM IKAN! insaniquarium Deluxe GAMEPLAY #1,770966,31426,2022-05-24T12:46:18Z,PT48M14S,1
3724,Windah Basudara,Mencoba Gacha Kinder Joy Semoga Dapat Mainan Langka!,1798324,75532,2022-05-24T11:06:03Z,PT1H18M11S,1
3725,Windah Basudara,ULANG TAHUN KE 6 Plants vs. Zombies 2 ADA EVENT TUMBUHAN BARU!,1429961,47324,2022-05-24T06:08:15Z,PT1H52M13S,1
3726,Windah Basudara,AKU INGIN LENGKAPKAN SKIN RARE! Stumble Guys,2851806,93227,2022-05-24T04:10:38Z,PT2H12M33S,1
3727,Windah Basudara,AYO KITA KALAHKAN BOSS KE DUA EL NACHO! Despicable Me: Minion Rush GAMEPLAY #2,453828,18855,2022-05-24T00:50:15Z,PT30M26S,1
3728,Windah Basudara,KISAH TENTANG INDOMIE YANG MENGERIKAN! Horror Noodles,1807044,83100,2022-05-23T14:08:06Z,PT14M24S,1
3729,Windah Basudara,BELI SEMUA DEKORASI TERMAHAL & UPGRADE MENTOK POM BENSIN KITA! Gas Station Simulator GAMEPLAY #12,1073936,40969,2022-05-22T16:27:35Z,PT1H19M25S,1
3730,Windah Basudara,GAME HOROR INDONESIA YANG MENAKUTKAN TAPI ANEH! Sundel Bolong Revenge,1346947,61921,2022-05-22T11:42:32Z,PT32M21S,1
3731,Windah Basudara,ADA YANG ANEH DI SUPERMARKET INI! I'm on Observation Duty 5 GAMEPLAY #3,1205108,43807,2022-05-21T16:40:58Z,PT56M55S,1
3732,Windah Basudara,APAKAH MCL BERSAMA VIEWERS BISA MENANG? Mobile Legends,610755,25941,2022-05-21T15:09:27Z,PT26M50S,1
3733,Windah Basudara,AKHIRNYA KITA BISA MELIHAT WUJUD SARAH! Warnet Simulator GAMEPLAY #20,1143795,50613,2022-05-21T10:19:25Z,PT1H15M32S,1
3734,Windah Basudara,SEMUA MISTERI SARAH TERUNGKAH HARI INI JUGA! Warnet Simulator GAMEPLAY #20,59963,5778,2022-05-21T08:51:45Z,PT1M55S,1
3735,Windah Basudara,PASUKAN BURUNG FULL ARMOR SUPER HERO! Angry Birds 2 GAMEPLAY #6,779598,32633,2022-05-21T06:12:53Z,PT56M54S,1
3736,Windah Basudara,AKHIRNYA HERO BINTANG 5 PERTAMA KU! Marvel Contest of Champions GAMEPLAY #2,756803,31055,2022-05-20T10:16:11Z,PT58M23S,1
3737,Windah Basudara,SEMOGA BISA 20 PIALA DAN DAPAT SKIN SPECIAL KE TIGA! Stumble Guys,3837474,135670,2022-05-20T08:25:43Z,PT58M19S,1
3738,Windah Basudara,ADA UFO MISTERIUS YANG JATUH DI POM BENSIN KU! Gas Station Simulator GAMEPLAY #11,1254897,47880,2022-05-19T15:13:18Z,PT1H30M,1
3739,Windah Basudara,ADA YANG MENGERIKAN DI STASIUN KERETA INI! I'm on Observation Duty 5 GAMEPLAY #2,1708478,56758,2022-05-16T16:29:56Z,PT1H19M14S,1
3740,Windah Basudara,AKU BELI MOUSE LABA LABA DAN DI GABUNG DENGAN SKUL BLACK BERET! APA YANG TERJADI? Point Blank,1691752,55188,2022-05-16T13:01:28Z,PT1H15M21S,1
3741,Windah Basudara,ADA YANG ANEH DI SEKOLAH INI! I'm on Observation Duty 5 GAMEPLAY #1,3196840,86564,2022-05-16T10:25:36Z,PT1H12M9S,1
3742,Windah Basudara,WUJUD EVOLUSI TERAKHIR DARI INDOMINUS REX! Jurassic World: The Game GAMEPLAY #18,1016788,39456,2022-05-16T07:49:21Z,PT1H4M57S,1
3743,Windah Basudara,ADA YANG MENGERIKAN DI RUMAH SAHABAT KITA! Jurnal Malam : Best Friend Chapter I,2095011,79755,2022-05-15T12:37:57Z,PT52M46S,1
3744,Windah Basudara,SEMOGA AKU DAPAT SKIN SPECIAL KE DUA! Stumble Guys,4171039,136162,2022-05-15T10:14:41Z,PT1H2M12S,1
3745,Windah Basudara,INI BARU GAME SUPER HERO MARVEL YANG SERU! Marvel Contest of Champions GAMEPLAY #1,802312,34563,2022-05-15T06:47:30Z,PT1H1M38S,1
3746,Windah Basudara,KITA BONGKAR MISTERI SARAH SEKARANG JUGA! Warnet Simulator GAMEPLAY #19,1549028,59199,2022-05-14T10:33:36Z,PT1H46M27S,1
3747,Windah Basudara,APAKAH TEORI SKIN SPECIAL ITU NYATA DAN APA YANG TERJADI KALAU DAPAT? Stumble Guys,5260344,174851,2022-05-13T15:09:33Z,PT1H16M38S,1
3748,Windah Basudara,GAME INI KATANYA PENUH DENGAN WAIFU! Destiny Girl,825032,35250,2022-05-13T08:03:15Z,PT33M10S,1
3749,Windah Basudara,AKU MAIN LAGI DEMI SKULL BLACK BERET SEMOGA HOKI! Point Blank,946294,37322,2022-05-13T07:06:27Z,PT1H3M58S,1
3750,Windah Basudara,GAME HOROR BUATAN INDONESIA TAPI KOK JADI GINI.... Mata Batin,1761364,73617,2022-05-13T02:41:12Z,PT34M54S,1
3751,Windah Basudara,AKU HARUS MEMILIH SALAH SATU MONSTER LEGENDARIS! My Singing Monster GAMEPLAY #4,690368,25933,2022-05-13T01:22:40Z,PT42M35S,1
3752,Windah Basudara,DEMI TANJIRO DAN NEZUKO AKAN KUMAINKAN GAME INI! Arena of Valor,1358296,60054,2022-05-10T16:27:42Z,PT1H30M10S,1
3753,Windah Basudara,ADA MOMMY LONG LEGS YANG HARUS KITA LAWAN DI Friday Night Funkin',440656,19167,2022-05-10T13:56:07Z,PT13M11S,0
3754,Windah Basudara,SAATNYA KITA PECAHKAN MISTERI YANG TERTUNDA! Warnet Simulator GAMEPLAY #18,981867,43668,2022-05-10T10:30:28Z,PT24M43S,1
3755,Windah Basudara,BAIKLAH AKU INGIN LVL 15 DI GAME PERANG REALISTIS INI! Modern Warships,709617,29417,2022-05-10T09:29:49Z,PT39M31S,1
3756,Windah Basudara,KAMU JADI WINDAH RAJA MEXICO! Windah raja mexico the game,743832,37271,2022-05-10T07:43:35Z,PT40M3S,1
3757,Windah Basudara,MELAWAN SEMUA BOSS Poppy Playtime: Chapter 2,1192845,40605,2022-05-09T12:43:00Z,PT24M43S,0
3758,Windah Basudara,AKHIRNYA GAME INDOMARET UPDATE JADI BAGUS BANGET! Indomaret Simulator GAMEPLAY #2,1391478,52989,2022-05-08T03:42:11Z,PT1H23M49S,1
3759,Windah Basudara,JADI BAGAIMANA NASIB MONIKA? Doki Doki Literature Club! TAMAT,318465,16511,2022-05-07T21:16:47Z,PT17M44S,1
3760,Windah Basudara,AKU INSTAL ULANG POINT BLANK UNTUK DAPATKAN TITLE V! Point Blank,1064347,38336,2022-05-07T19:46:06Z,PT1H29M48S,1
3761,Windah Basudara,SAATNYA KITA TABRAK MONSTER TIKUS DENGAN MOBIL! RATUZ TAMAT,393597,20442,2022-05-07T16:14:21Z,PT42M39S,1
3762,Windah Basudara,AKHIR DARI MOMMY LONG LEGS! Poppy Playtime Chapter 2 TAMAT,1145388,50390,2022-05-07T13:50:24Z,PT1H3M13S,1
3763,Windah Basudara,AKHIRNYA CHAPTER 3 SUDAH RILIS LETS GO! Warnet Simulator GAMEPLAY #17,1068318,45968,2022-05-07T10:19:53Z,PT1H13M10S,1
3764,Windah Basudara,MENUJU 7 JUTA SUBSCRIBER SAMBIL BERBAGI KEBAHAGIAAN KE TEMAN TEMAN STREAMER!,2922705,166568,2022-05-06T14:17:52Z,PT2H22M28S,1
3765,Windah Basudara,ADA BONEKA MENGERIKAN LAINNYA YANG MENGINTAIMU! Poppy Playtime Chapter 2 GAMEPLAY #1,1661196,62870,2022-05-06T11:10:40Z,PT1H26M53S,1
3766,Windah Basudara,BETAPA MENGERIKAN 20 NUKLIR DILEDAKAN SEKALIGUS! Fireworks Mania,1183247,49740,2022-05-05T15:20:17Z,PT52M10S,1
3767,Windah Basudara,AKU BELI SEMUA MOBIL YANG PALING MAHAL! Angry Birds Go! TAMAT,658628,27482,2022-05-05T12:39:18Z,PT1H47M27S,1
3768,Windah Basudara,BIOSKOP PENUH JADI KITA MAIN GAMENYA DULU! Mr Strange The Power Of Magic,486750,22236,2022-05-05T07:06:23Z,PT5M43S,1
3769,Windah Basudara,AKU MENCOBA KARAKTER FULL CASH DAN SETTING MACRO! Point Blank,1310736,47255,2022-05-05T06:45:16Z,PT1H14M49S,1
3770,Windah Basudara,MISTERI PALING MENGERIKAN! APA ARTI DARI SEMUA INI? Warnet Simulator GAMEPLAY #16,742194,34831,2022-05-05T03:45:16Z,PT43M34S,1
3771,Windah Basudara,ADA KAPAL INDONESIA KRI GOLOK DI GAME INI! LANGSUNG KU FULL UPGRADE! MODERN WARSHIP,813936,39983,2022-05-04T11:07:05Z,PT12M9S,0
3772,Windah Basudara,PARA WIBU AYO BERKUMPUL DAN TEBAK SIAPAKAH MEREKA? Seberapa WIBUnya Lu TAMAT,674050,35810,2022-05-04T09:11:21Z,PT27M58S,1
3773,Windah Basudara,KATANYA INI GAME PERANG KAPAL PALING SERU DI HANDPHONE! MODERN WARSHIPS,284433,14572,2022-05-03T15:57:42Z,PT53M56S,1
3774,Windah Basudara,Mencoba NAMATIN Game THR Online,738068,45132,2022-05-03T12:16:11Z,PT13M3S,1
3775,Windah Basudara,MEREKA KUNING DAN JELEK DAN BERLARI HIDUP LAGI! Despicable Me: Minion Rush GAMEPLAY #1,648602,27836,2022-05-03T10:40:11Z,PT41M6S,1
3776,Windah Basudara,AKU MENCOBA MAIN GAME TEMBAKAN YANG KATANYA LEGENDARIS! Point Blank,1593476,59229,2022-05-03T08:48:14Z,PT1H42M39S,1
3777,Windah Basudara,SEMAKIN BANYAK HAL ANEH ANAK KECIL JANGAN NONTON! Postal 2 TAMAT,402018,19643,2022-05-03T03:08:21Z,PT59M30S,1
3778,Windah Basudara,AYO KITA KALAHKAN BOSS BURUNG LAINNYA DI BALAPAN! Angry Birds Go! GAMEPLAY #2,428041,22791,2022-05-03T00:35:26Z,PT49M44S,1
3779,Windah Basudara,KITA NYALAIN PETASAN BARENG DI MALAM TAKBIRAN! Fireworks Simulator 3D,677684,39279,2022-05-01T14:06:19Z,PT51M13S,1
3780,Windah Basudara,UPDATE BARU AKHIRNYA PC WARNET KU FULL GOLD! Warnet Simulator GAMEPLAY #15,1168047,43046,2022-05-01T04:57:25Z,PT1H26M54S,1
3781,Windah Basudara,AKHIRNYA SANG MALING HIDUP BAHAGIA DENGAN MOBIL TERMAHAL! Thief Simulator TAMAT,457440,23426,2022-04-30T20:10:31Z,PT36M37S,1
3782,Windah Basudara,SIAPA YANG HOKI DAPAT SKIN ALUCARD LEGEND? #Shorts,4077980,243633,2022-04-30T11:24:00Z,PT59S,0
3783,Windah Basudara,ADA ULAR RAKSASA MENGERIKAN DI HOTEL INI! No Snake Hotel,695868,38197,2022-04-30T10:50:53Z,PT18M44S,1
3784,Windah Basudara,TEBAK TEBAKAN WIBU! Seberapa WIBUnya Lu GAMEPLAY #1,799416,44274,2022-04-30T09:38:09Z,PT29M38S,1
3785,Windah Basudara,GAME PERMEN INI BANYAK BANGET YANG DOWNLOAD DI PLAYSTORE! Candy Crush Saga,236484,15760,2022-04-30T07:51:53Z,PT23M32S,1
3786,Windah Basudara,EVENT MAHA SPEKTAKULER 515 MOBILE LEGENDS! KITA REVIEW 3 HERO!,1058550,47005,2022-04-29T12:15:31Z,PT1H37M11S,1
3787,Windah Basudara,AKHIRNYA TAMAT 50 KALI DAN DAPAT GUCI EMAS! Getting Over It with Bennett Foddy,1392678,50388,2022-04-28T23:15:16Z,PT14M45S,1
3788,Windah Basudara,ADA MISTERI YANG DISEMBUNYIKAN DI RUMAH SAKIT INI! Beside Myself,1345712,49047,2022-04-28T22:21:48Z,PT1H36M54S,1
3789,Windah Basudara,AKHIRNYA KENGERIAN RUMAH INI BERAKHIR! I'm on Observation Duty 2,925345,34225,2022-04-28T18:55:14Z,PT1H14M24S,1
3790,Windah Basudara,PENGORBANAN DAN PENGHIANATAN YANG SANGAT SAD MOMENT! Call of Duty: Modern Warfare 2 TAMAT,765476,28769,2022-04-28T12:23:25Z,PT2H6M7S,1
3791,Windah Basudara,KITA BELI TELUR DINOSAURUS #Shorts,3141681,210438,2022-04-28T12:13:55Z,PT51S,0
3792,Windah Basudara,GAME SIMULATOR ANIME PENUH MISTERI! Sakura School Simulator,1513022,62942,2022-04-28T09:25:03Z,PT48M52S,1
3793,Windah Basudara,KITA KEMBALI MENJAGA KAMERA DI RUMAH MISTERIUS! I'm on Observation Duty 2,951664,38623,2022-04-27T21:30:13Z,PT56M36S,1
3794,Windah Basudara,APAKAH BENAR NAPOS MASIH HIDUP? Warnet Simulator GAMEPLAY #14,1112746,52151,2022-04-27T10:59:09Z,PT30M3S,1
3795,Windah Basudara,AKU BELI MAINAN ROBLOX KATANYA BISA DAPAT KODE SKIN LEGEND!,579418,30030,2022-04-27T09:19:06Z,PT46M4S,1
3796,Windah Basudara,KESEMPATAN TERAKHIR MENDAPATKAN MESSI DAN MBAPPE! eFootball 2022,1637542,60341,2022-04-27T08:14:16Z,PT2H24M16S,1
3797,Windah Basudara,PETASAN SEBANYAK INI AKAN KITA NYALAKAN APA YANG AKAN TERJADI! Fireworks Mania,989750,48589,2022-04-26T10:28:01Z,PT36M7S,1
3798,Windah Basudara,KITA HANYA MAMPIR SEBENTAR KE MINIMARKET INI! Just Stopping By,531374,26517,2022-04-25T21:39:57Z,PT27M27S,1
3799,Windah Basudara,AKHIRNYA AKU MELANJUTKAN PAMALI KUNTILANAK! Pamali: The White Lady GAMEPLAY #1,1529684,55966,2022-04-25T21:11:12Z,PT1H31M56S,1
3800,Windah Basudara,PLOT TWIST PALING EPIC! RUPANYA CAPTAIN PRICE DAN SOAP? Call of Duty: Modern Warfare 2 GAMEPLAY #2,511415,18328,2022-04-25T17:45:23Z,PT1H46M55S,1
3801,Windah Basudara,EXPERIMENT MONSTER YANG MENGERIKAN DI PENJARA! RATUZ GAMEPLAY #1,649661,26271,2022-04-25T15:37:35Z,PT1H6M17S,1
3802,Windah Basudara,PEMAIN LEGEND GRATIS SIAPA YANG AKAN KU DAPAT? eFootball 2022,818785,37217,2022-04-25T13:21:55Z,PT39M37S,1
3803,Windah Basudara,UPDATE BARU PENUH MISTERI DAN EASTER EGG EPIC! Warnet Simulator GAMEPLAY #13,928537,45048,2022-04-25T10:58:44Z,PT52M15S,1
3804,Windah Basudara,MEMANG ADA SUPERMAN DI GAME INI? Tahu Bulat GAMEPLAY #2,511544,25069,2022-04-25T09:28:26Z,PT48M6S,1
3805,Windah Basudara,MISTERI ANAK YANG HILANG DI JEPANG! Missing Children | è¡Œæ–¹ä¸æ˜Ž,818657,39376,2022-04-24T21:31:36Z,PT59M37S,1
3806,Windah Basudara,GAME TENTANG JAJANAN INDONESIA! Tahu Bulat GAMEPLAY #1,764331,40013,2022-04-24T03:51:31Z,PT29M50S,1
3807,Windah Basudara,AKU BELI MONSTER PALING MAHAL SUARANYA ENAK BANGET! My Singing Monster GAMEPLAY #3,1168057,34498,2022-04-24T02:56:01Z,PT49M6S,1
3808,Windah Basudara,RUPANYA MASIH ADA BURUNG LEGEND RAHASIA DI LEVEL 87! Angry Birds 2 GAMEPLAY #5,550954,22869,2022-04-24T01:48:52Z,PT1H29M34S,1
3809,Windah Basudara,ADA DUA ICONIC BARU NAMUN SIAPAKAH MEREKA APAKAH MEREKA PEMAIN LEGEND? eFootball 2022,1229160,51351,2022-04-22T07:44:15Z,PT1H45M48S,1
3810,Windah Basudara,APAKAH BURUNG LEGEND RAHASIA DI LEVEL 68 ITU NYATA? Angry Birds 2 GAMEPLAY #4,992234,31583,2022-04-22T03:32:19Z,PT2H18M58S,1
3811,Windah Basudara,KONFLIK ERA PERANG MODERN BERLANJUT! Call of Duty: Modern Warfare 2 GAMEPLAY #1,529350,22799,2022-04-21T06:31:32Z,PT52M5S,1
3812,Windah Basudara,AKHIRNYA KELUARGA TED SELAMAT DAN BAHAGIA! 60 Seconds! Reatomized TAMAT,1080169,44856,2022-04-20T15:03:19Z,PT54M57S,1
3813,Windah Basudara,PERJUANGAN KELUARGA INI BERAKHIR SEPERTI.... 60 Seconds! Reatomized GAMEPLAY #5,1164552,39151,2022-04-20T12:06:29Z,PT2H50M42S,1
3814,Windah Basudara,ADA YANG MENGINTAI DI DALAM KEGELAPAN! Lurk In The Dark,1753405,61389,2022-04-19T21:34:54Z,PT55M13S,1
3815,Windah Basudara,KATANYA GAME INI PENUH DENGAN KONTROVERSI! Postal 2 GAMEPLAY #1,443597,19181,2022-04-19T20:22:52Z,PT57M15S,1
3816,Windah Basudara,KALI INI KELUARGA CEMARA INI HARUS SELAMAT SEMUA! 60 Seconds! Reatomized,117819,5712,2022-04-19T17:23:39Z,PT32M25S,1
3817,Windah Basudara,KONFLIK PERANG MODERN BERAKHIR MENYEDIHKAN.... Call of Duty: Modern Warfare TAMAT,746654,27071,2022-04-19T16:57:14Z,PT2H16M16S,1
3818,Windah Basudara,ADA GAME KARYA BANGSA TENTANG PEGAWAI INDOMARET! Indomaret Simulator GAMEPLAY #1,1212416,52170,2022-04-19T11:02:17Z,PT43M28S,1
3819,Windah Basudara,AKU TOP UP UNTUK BREEDING MONSTER BARU! My Singing Monster GAMEPLAY #2,1149880,36317,2022-04-19T09:32:09Z,PT1H10M25S,1
3820,Windah Basudara,INILAH WUJUD MENGERIKAN BOM NUKLIR DI TIMUR TENGAH! Call of Duty: Modern Warfare GAMEPLAY #2,756745,29543,2022-04-18T08:39:58Z,PT1H16M15S,1
3821,Windah Basudara,ADA UPDATE BARU TEROWONGAN KEMATIAN! Back 4 Blood,489414,17703,2022-04-18T08:37:42Z,PT2H1M14S,1
3822,Windah Basudara,ANAK YANG LUCU MENJADI RAJA KEGELAPAN DARTH VADER! LEGO Star Wars: The Skywalker Saga GAMEPLAY #4,244317,10597,2022-04-17T21:36:22Z,PT13M40S,0
3823,Windah Basudara,KONON KATANYA HOTEL INI SANGAT MENGERIKAN! Death Trips,555328,35838,2022-04-17T21:11:01Z,PT4M31S,1
3824,Windah Basudara,JAYA ESPORT BERSANTAI LAGI DI ROBLOX!,549821,22213,2022-04-17T17:23:09Z,PT1H34M55S,1
3825,Windah Basudara,AKHIR DARI CHAPTER DUA YANG SANGAT EPIC NAMUN SAD.... Warnet Simulator GAMEPLAY #12,1641893,52766,2022-04-17T13:50:25Z,PT1H39M21S,1
3826,Windah Basudara,AKHIRNYA WINDAH BASUDARA KELUAR DARI KANTOR! Warnet Bocil Simulator TAMAT,623940,25950,2022-04-17T09:54:50Z,PT42M21S,1
3827,Windah Basudara,MASTER YODA MELAWAN DARTH SIDIOUS! LEGO Star Wars: The Skywalker Saga GAMEPLAY #3,298966,14480,2022-04-17T08:53:06Z,PT1H11M30S,1
3828,Windah Basudara,ADA MONSTER YANG BISA BER NYANYI! My Singing Monsters GAMEPLAY #1,1373739,41676,2022-04-17T05:50:09Z,PT1H26M34S,1
3829,Windah Basudara,TURNAMENT MONSTER TERKUAT SEASON 2! SIAPAKAH RAJANYA SEKARANG! Animal Revolt Battle Simulator,1239814,42713,2022-04-17T03:42:40Z,PT1H8M31S,1
3830,Windah Basudara,ADA KUTUKAN MENGERIKAN DI STASIUN RADIO INI! The Radio Station | æ·±å¤œæ”¾é€,1636093,62327,2022-04-15T21:37:15Z,PT1H2M19S,1
3831,Windah Basudara,APAKAH INI AKHIR PERJALANAN PENCURI? Thief Simulator GAMEPLAY #7,472490,19113,2022-04-15T19:59:29Z,PT1H30M46S,1
3832,Windah Basudara,DIA SEPERTI DORA THE EXPLORER TAPI KOK JADI SEREM.... Amanda The Advanturer,813346,37933,2022-04-15T16:05:55Z,PT11M52S,1
3833,Windah Basudara,INILAH KONFLIK ERA PERANG MODERN! Call of Duty: Modern Warfare GAMEPLAY #1,969101,40252,2022-04-15T11:14:37Z,PT1H19S,1
3834,Windah Basudara,INILAH LEGENDA PEMAIN TAMPAN DAN MODEL DAVID BECKHAM SEMOGA DAPAT! eFootball 2022,1301346,54660,2022-04-15T09:35:51Z,PT1H10M7S,1
3835,Windah Basudara,ADA YANG ANEH DENGAN POM BENSIN INI! Haunted Gas Station,847140,38634,2022-04-14T19:40:44Z,PT20M28S,1
3836,Windah Basudara,KETEMU ILMUWAN GILA LALU DI KIRIM KE BULAN! 60 Seconds! Reatomized GAMEPLAY #4,1870577,50526,2022-04-14T18:38:10Z,PT2H58M30S,1
3837,Windah Basudara,TEORI MARY JANE MENJADI MUTANT DAN MENYELAMATKAN KELUARGA? 60 Seconds! Reatomized GAMEPLAY #3,1000857,38092,2022-04-14T15:30:51Z,PT1H48M9S,1
3838,Windah Basudara,KITA HANYA PUNYA 60 DETIK SEBELUM METEOR MENABRAK BUMI! Meteor 60 Seconds!,1193968,49581,2022-04-14T10:56:08Z,PT42M9S,1
3839,Windah Basudara,BURUNG PEMARAH INI BISA BALAPAN! Angry Birds Go! GAMEPLAY #1,548426,26566,2022-04-14T09:30:42Z,PT34M27S,1
